title;url;content"이재명 ""12일 출석"" vs 檢 ""이번주 오라"" 또다시 줄다리기";/news/articleView.html?idxno=28784;"쌍방울그룹의 대북송금 의혹을 수사 중인 수원지검이 ""12일 출석하겠다""는 이재명 민주당 대표에게 “이번주에 출석하라”고 통보했다. 앞서 수원지검 형사6부(김영남 부장검사)는 지난 8월 23일 쌍방울 대북송금 의혹과 관련한 제3자뇌물 혐의와 관련해 이 대표에게 “8월 30일 출석해 조사받아라”라고 통보했으나 이 대표가 ""내일(24일) 오전에 조사를 받으러 가겠다""고 이견을 보이면서 소환조사가 한 차례 무산된 바 있다. 이후 검찰은 이 대표 측에 9월 4일 소환조사에 응할 것을 재차 요청했고, 이 대표 측은 ""4일에는 출석이 불가능하고 이달 11∼15일 중에 출석하겠다""고 답하면서 두 번째 소환조사 또한 이뤄지지 않았다.지난 1일엔 이 대표가 돌연 ""4일 오전에만 조사받겠다""고 밝히자, 검찰은 ""오전 2시간 만에 조사를 중단할 수 없다""는 입장을 내보이며 양측의 이견이 좁혀지지 않았다. 이에 이 대표는 다시 검찰에 “12일 출석”을 통보했고, 여기에 검찰이 “7~9일 사이 오라”라고 답한 것이다.※주간조선 온라인 기사입니다."
"이재명, 김만배 인터뷰 논란에 ""폭력배 동원한 국힘의 적반하장""";/news/articleView.html?idxno=28780;이재명 더불어민주당 대표가 ‘김만배 허위 인터뷰 의혹’과 관련해 “적반하장, 후안무치 대표적 사례”라고 일갈했다. 이 대표는 6일 공개된 CBS라디오 ‘김현정의 뉴스쇼’ 인터뷰에서 “대선 공작 예로 치면 국민의힘이 조직폭력배 동원해서 나한테 조폭 자금 20억 줬다, 이런 게 진짜 선거 공작 아닙니까”라며 “그런데 그거 무혐의했다가 법원이 기소 결정했대요“라며 이같이 밝혔다.검찰 소환 또는 구속영장 청구를 막기 위해 단식하는 것 아니냐는 여권의 비판에 대해서는 “그 사람들은 아무 데나 말 갖다 붙이면 말인 줄 아는 것 같아요. 제가 조사를 회피했습니까? 조사받겠다고 하지 않습니까? 그런데 검찰이 이런 식으로 검찰 권력을 정치공작에 악용하는 것은 결코 있어서는 안 될 일”이라고 했다. 그러면서 “우리가 명확하게 입장을 냈잖아요. 방탄국회 소집하지 않는다. 8월 회기도 잘랐지 않습니까? 수사하다가 2년 됐잖아요, 변호사비 대납이니. 왜 하필이면 표결을 강요하냐. 우리 야당의 분열과 갈등을 노리는 거 아니겠습니까”라고 반문했다. 그는 “국민이 맡긴 권력을, 공정하게 사용해야 될 권력을 정치적 목적으로 악용하면 이건 민주 국가가 아니지. 다음 주에는 시간을 맞춰서 제가 나간다고 얘기했지 않습니까”라고 덧붙였다. 이 대표는 “(단식을) 끝내는 조건은 있을 수가 없는 게 제가 국민을 향해서 국민이 겪는 고통을 함께 느끼고 현재의 상황이 얼마나 절박한가를 보여주기 위해서 보여드리기 위해서 하는 일이라 이거 해주면 안 할 게, 저거 하면 안 할 게 이렇게 말할 수가 없는 것”이라고 밝혔다.※주간조선 온라인 기사입니다.
내일 총선이라면?… 국힘·민주 격차 0.6%p 더 접전;/news/articleView.html?idxno=28778;‘내일이 국회의원 총선이라면 어느 정당 후보에게 투표할 것인가’라는 질문에 국민의힘과 더불어민주당이 지난달과 비교해 오차범위 내에서 더욱 접전을 벌이는 것으로 나타났다. 연햡뉴스와 연합뉴스TV가 공동으로 여론조사 업체 매트릭스에 의뢰해 지난 9월 2~3일 전국 만 18세 이상 남녀 1000명을 대상으로 실시한 여론조사 결과에 따르면, 내일 총선 시 국민의힘 소속 후보에게 투표하겠다는 응답이 30.5%, 민주당 후보에게 투표하겠다는 응답이 29.9%로 나타났다. 양당 간 격차는 0.6%포인트로 오차범위(95% 신뢰수준에서 ±3.1%p) 이내다.지난달 5~6일 실시한 직전 조사(국민의힘 31.3%, 민주당 27.4%)와 비교하면 국민의힘은 0.8%포인트 하락하고, 민주당은 2.5%포인트 올랐다. 양당 간 격차는 3.9%포인트로 이번 조사에서 더욱 좁혀진 셈이다. ‘지지 정당이 없다’는 응답은 18.0%로 지난달 조사(17.8%)보다 0.2%포인트 더 늘었고, ‘정당에 투표하겠다’는 응답은 2.3%, ‘기타 정당’은 5.2%로 집계됐다. ‘투표할 의향이 없다’는 9.3%, ‘모름·무응답’은 4.8%였다.정당 지지도는 국민의힘 34.0%, 더불어민주당 28.1%, 정의당 4.4% 순으로 나타났다. ‘지지 정당이 없다’고 답한 응답자는 28.4%였다. 직전 조사와 비교하면 국민의힘은 3.4%포인트, 민주당은 0.1%포인트, 정의당은 0.7%포인트 하락한 수준이다.이번 조사는 휴대전화 가상번호(100%)를 이용한 전화 면접 방식으로 진행됐으며 응답률은 14.1%였다. 자세한 사항은 중앙선거여론조사심의위원회 홈페이지를 참조하면 된다.※주간조선 온라인 기사입니다.
살찔 수 있는 의외의 습관 8가지;/news/articleView.html?idxno=28727;평소처럼 운동도 하고 꾸준히 식단 조절도 하고 있는 것 같은데 살이 찔 때가 있다. 여기 미국 건강전문매체 잇디스가 만난 건강 전문가들은 우리가 일상에서 간과하기 쉬운 부분을 말한다. 우리의 체중을 늘리는 교활하고 작은 습관들이다.1) 초밥을  많이 자주 먹는다초밥은 맛도 있고, 많은 사람들이 건강에 좋은 음식이라 생각한다. 하지만 롤초밥은 먹으면 채소, 식욕을 억제하는 섬유질, 그리고 양질의 단백질을 충분히 섭취하기 어렵다. 초밥을 먹고 와도 곧 배가 고파지는 경우가 많은데, 집에 돌아와 고열량 음식을 채워넣곤 한다.2) 먹는 것에 지나치게 신경 쓴다.다이어트를 할 때 무엇을 먹는 지 신경 쓰는 것은 필요한 일이지만, 지나치게 조심스럽고 제한적일 수 있다. 이는 신체가 실제로 필요한 것보다 훨씬 더 적은 칼로리를 소비하게 할 수 있다. 몸은 신진대사를 늦추고 지속적인 칼로리 부족을 대처하기 위해 더 적은 칼로리를 소모한다. 대사 둔화가 일어나는 것이다.3) 향이 나는 제품을 많이 사용한다많은 이들이 간과하는 부분이다. 미국 건강전문매체 잇디스는 우리가 가장 좋아하는 향기가 나는 바디 로션, 헤어 케어 제품, 심지어 향이 나는 세정제에조차도 우리의 호르몬을 방해하고 비만을 촉진하는 화학물질의 일종인 '프탈레이트'가 있을 수 있다고 경고한다. 이 화학물질들은 비만균이라고 불리는데, 체중이 갑자기 증가하는 것처럼 보일 때 이들 독소 과다가 원인이 되기도 한다.4) 수면부족이다충분한 숙면을 취하는 것은 체중 감량에 있어서도 중요한 부분이다. 수면 습관이 조금이라도 바뀌면 수면의 질은 크게 영향을 받을 수 있다. 수면 부족은 당신의 몸이 에너지를 갈망하게 만든다. 쉽게 섭취할 수 있는 설탕과 정제된 탄수화물은 신체에 즉각적인 만족을 주지만, 이는 과잉 칼로리와 과식으로 이어지기 쉽다.게다가 또다른 연구는 깊은 수면의 양이 줄거나 수면 부족이 근육 성장을 방해할 수 있다는 것을 보여준다. 부족한 근육은 대사량을 떨어뜨려 섭취하는 칼로리만큼 체중이 늘어날 가능성이 많다.5) 새로운 식기세트를 샀다우리가 산 귀여운 새 그릇 세트가 급격한 체중 증가의 원인일 수 있다. 많은 이들이 경험하는 것이다. 새로운 그릇을 가득 채우고자 하는 마음이 크기 때문에 평소보다 음식과 칼로리 섭취가 증가할 수 있다.6) 진통제를 복용한다진통제 복용의 일반적 부작용은 변비다. 굳어서 잘 움직이지 않는 장이 급격한 체중 증가를 초래할 수 있다. 불편한 급격한 체중 증가는 일반적으로 복부에서 가장 많이 느껴진다. 그래도 이는 일단 배변을 하면 체중이 증가한 만큼 빠르게 체중을 감소시킬 수 있다.7) 건강에 좋은 지방을 너무 많이 먹는다건강한 지방을 충분히 섭취하는 것은 매우 중요하다. 건강한 지방은 염증을 줄이고, 콜레스테롤 수치를 높이며, 혈당을 관리하는 데 도움을 주는 단일 불포화 지방과 다중 불포화 지방으로 구성되어 있다. 하지만 무엇이든 너무 많이 하는 것은 결코 좋은 것이 아니다. 지방은 단백질이나 탄수화물보다 1그램당 칼로리가 더 많기 때문에 지방의 칼로리 섭취가 더 높다. 적당히 건강한 지방이 좋다는 것을 기억하자.8) 끼니를 거른다식사를 거르면 한 끼 식사의 칼로리가 없기 때문에 살을 뺄 수 있다고 생각하겠지만, 이는 잘못된 생각이다. 오히려 식사를 거르는 것은 실제로 체중 증가를 일으킨다. 식사를 거른 사실 때문에 나중에 배가 고파지고, 이는 과도한 식사로 이어지는 경우가 많기 때문이다.※주간조선 온라인 기사입니다.
물아일체의 푸르름, 차밭은 구원이다;/news/articleView.html?idxno=28696;유럽에 와인이 있다면 아시아에는 차(茶)가 있다. 차와 와인은 양쪽 문명을 대표하는 음료이다. 이 양대 음료에는 기호품이면서 동시에 기호품을 뛰어넘는 그 어떤 정신이 들어 있다고 할 수 있다. 와인에 플라톤이 말한 이데아(Idea)가 들어 있다고 확실하게 이야기할 수는 없지만, 차(茶)에는 도(道)가 들어 있다고 확실하게 이야기할 수 있다.동양에서는 단순히 마시는 음료를 뛰어넘어 차를 다도(茶道), 다예(茶藝)로까지 끌어올려 승화시켰다. 동양은 서양의 와인을 배우고 있고, 서양은 동양의 차를 귀하게 여겨 일찍이 아편전쟁까지 일으키지 않았나. 유럽의 귀족이 와인의 재료가 되는 포도밭, 즉 와이너리를 가지고 있는 게 부귀(富貴)의 상징이라고 한다면 동양에서는 차밭, 즉 다원(茶園)을 하나 가지는 게 식자층의 소망이었다.다원 하나 갖는 게 식자층의 소망 차밭은 단순한 밭이 아니다. 밭 중의 최고가 인삼밭이고, 인삼밭보다도 한 수 위가 바로 차밭이 아닌가 싶다. 와인과 차는 여러 면에서 비교 대상이다. 첫째는 산지다. 포도가 어느 지역에서 자란 것인지가 중요하다는 의미다. 와인이 프랑스산인가 칠레산인가 스페인산인가가 중요하듯이 차도 마찬가지로 지역이 중요하다. 어느 산, 어떤 지역에서 나온 찻잎으로 차를 만들었느냐가 중요하다는 의미다. 중국의 경우 윈난성의 6대 차산인가 아닌가, 무이산 주변인가 아닌가가 중요하고 한국은 지리산의 하동인가 아닌가, 월출산의 강진인가 섬진강 주변인가가 중요하다. 둘째는 빈티지이다. 몇 연도 산(産)인가를 따지는 것도 와인이나 차나 마찬가지다. 해마다 작황과 기후 조건이 들쑥날쑥해서 그렇다. 세 번째는 누가 만들었는가가 중요하다. 차는 제다(製茶)가 중요하다. 차를 덖고 찌고 긴압(緊壓·압력을 가해 찻잎을 누르는 과정)한 장인이 누구인가에 따라 맛이 달라진다. 이런 구분에 따르면 와인 산지가 수백 군데 수천 군데가 될 수 있지만 차도 마찬가지다. 누가 만드느냐에 따라 다르고, 빈티지도 다 다르기 때문에 이 안에 무궁한 우주가 있다. 공부하기가 어려운 것이다. 공부할 것이 한두 가지가 아니다. 특히 차는 차도구(茶道具), 즉 찻잔과 찻사발, 그리고 차호(茶壺)를 주 내용으로 하는 도자기의 세계도 공부해야 하기 때문에 와인보다 훨씬 더 방대한 우주가 기다리고 있다.조선 시대의 정신음료 조선의 전통에서 차는 먹물계층의 기호품이면서 정신음료(精神飮料)였다. 무식자 계층보다는 식(識)이 많이 들어간 먹물계층에서 유난히 차에 대한 찬미가 많았다. 고려시대는 한국차의 전성기였는데, 불교 승려들이 차를 즐겼다. 화두에 집중하는 간화선풍(看話禪風)과 차는 궁합이 맞았던 이유도 있다. 화두에 집중하면 졸음과 상기증이 올 수 있는데, 이 두 가지를 예방하는 데에 차가 효과적이었다.불교에서 유교로 바뀐 조선시대에도 차는 명맥이 끊어지지 않고 유지되어 오기는 했다. 소수의 인텔리 계층에 의해서 그 기록들이 남아 있다. 조선 후기 다산과 초의 같은 인물들이 그 대표적인 사례이다. 근래에 먹물이면서 차밭까지 가지고 있는 인물이 전남 곡성에 있다. 최성민(崔星民·70) 선생이다. 50세 무렵에 서울생활을 접고 시골로 내려왔다. 서울대를 나와서 성균관대에서 동양철학으로 박사까지 받았다. 박사 논문은 ‘한국 수양다도의 모색’. ‘수양다도’는 그의 차철학(茶哲學)의 핵심이다. 차는 동양철학에서 말하는 수양과 직결되어 있다는 취지이다.그는 유가, 불가, 도가의 철학을 두루 공부했다. 말하자면 차를 단순한 기호품이 아니라 동양사상에 바탕을 둔 수양이라는 도의 경지까지 끌어올리는 이론적 토대를 마련했다고나 할까. 거기에다 글도 잘 쓴다. 글 잘 쓰는 것도 큰 무기이다. 한겨레신문 창간 발기인도 했고, 논설위원도 지냈다. 문화부 기자를 할 때는 전국의 문화유적지를 탐방하고 다니면서 한국 토종문화에 대한 심도 있는 기사를 쓰기도 했다. 이 현장답사의 경험이 큰 밑천이 된 것 같다. 그러나 성질이 괴팍하다. 상대방의 잘못을 지적하는 데에 머뭇거림이 없다. 봐주는 것은 없다. 바로 찔러 버린다. 차계(茶界)에서는 저승사자와 같은 인물이다. 그래서 차인들은 같이 놀려고 하지 않는다. 언제 그의 송곳에 찔릴지 모르기 때문이다. 이런 성정 때문에 차계에서 왕따 상태에 있다고 해도 과언이 아니다. ‘율곡필하무완인(栗谷筆下無完人)’이라는 말이 있는데 비판을 잘했던 율곡의 붓끝에서 온전한 사람이 없었듯이 차계에서 성민의 비판에 그슬리지 않은 사람이 없다(星民筆下無完人). 그래도 한국 전통차 복원에 대한 집념을 놓지 않고 있다. 나 같으면 놨을 텐데. 그나마 다행인 것이 부인의 존재이다. KBS 국악프로그램 PD를 오랫동안 했던 부인이 곡성에서 같이 살면서 남편의 모난 측면을 보강해주고 있다. 수양다도를 모색하는 차 명인 최성민 부부가 가지고 있는 차밭은 약 4만평(약 13만2000㎡)에 이르는 ‘산절로 야생다원(野生茶園)’이다. 전남 곡성군 고달면과 오곡면에 걸쳐 있다. 양쪽 차밭의 중간을 섬진강이 흐른다. 섬진강 왼쪽에는 고달면의 2만평이 있고, 오른쪽에는 오곡면의 2만평이 있다. 야생다원이라는 것은 비료·농약을 안 쓴다는 뜻이다. “정말로 안 쓰냐?”고 물었더니 “안 쓴다”면서 이렇게 얘기한다. “그래서 차 농사는 신선농사(神仙農事)라고 한다. 밭갈고 김을 맬 필요도 없다. 그대로 두면 된다. 베트남, 중국, 일본에도 여기같이 비료·농약을 안 쓰고 자연 그대로 방치하는 야생다원은 없는 것으로 알고 있다.”이런 문답도 나눴다.“차밭 앞으로 섬진강 물소리가 들린다. 강 바닥에 박힌 돌밭 사이를 섬진강물이 흘러가면서 부딪치는 여울물 소리가 정겹다. 이 물소리가 먹고산다고 쌓인 긴장을 풀어주는 것 같다. 살아보니 어떤가?” “물소리는 긴장을 풀어주는 효과가 확실하게 있다. 여기에서 살다 보니까 사회생활 하면서 쌓인 사회독(社會毒)과 상처를 치료하는 데 도움이 된 것 같다. 지인들로부터 과거보다 내 얼굴이 편해졌다는 이야기를 많이 듣는다. 아마도 이 섬진강에 흐르는 강물 소리와 안개가 나를 치유한 것 같다.”“안개는 차의 성장에 도움이 되나?”“물론이다. 차는 안개가 영양분이다. 적당한 습기가 도움이 된다. 그리고 약간 그늘이 져야 한다. 안개가 끼면 직접적인 햇볕을 가려준다. 차나무의 발육에는 반음반양(半陰半陽)이 좋다고 한다. 정확하게 이야기하면 음이 양보다 더 많은 환경이 좋다. 음이 양보다 6 대 4 내지는 7 대 3으로 더 많은 게 유리하다. 안개는 햇볕을 가려주면서도 습기를 제공하기 때문에 안개가 많은 곳에서 명차가 생산된다. 이런 입지조건을 일부러 선택해서 내가 20여년 전부터 여기에다 차씨를 뿌리고 차밭을 조성해 차나무를 기른 것이다.”“차가 지닌 최대의 매력은 무엇이라고 생각하는가?”“다신(茶神)이다. 차가 지닌 신묘함이 있다. 이걸 원색적으로 표현한다면 신기(神氣)라고나 할까. 사람을 매료시키는 신묘함이다. 사람을 매료시켜서 사람을 거듭나게 만든다. 마음을 평안하게 만들고, 각성시키는 효과도 있고, 한 단계 더 높은 고양된 정신상태에 이르게 한다.” 차가 뿜어내는 청엽알코올의 힘 최성민에 의하면 사람 허리쯤 되는 높이에 녹색잎으로 우거져 있는 차밭에 들어서면 차가 지닌 그 어떤 신묘함이 다가온다고 한다. 찻잎에서 나오는 향기가 녹향이다. 피톤치드 가운데 최상급이 찻잎에서 나온다는 것이다. 바로 청엽알코올이라고 하는 향이다. 그 청량함은 이루 말할 수 없다. 아침 안개가 끼었을 때 느끼는 느낌이 있고, 저녁 석양이 질 때의 느낌이 다르다. 밤에 달이 떴을 때 차밭에 가보면 또 다른 느낌이 있다. 그 느낌이 인간의 긴장을 이완시켜주고 인간 본연의 차분한 심성, 즉 샬롬(평화·평안)을 가져다준다.봄가을에도 좋다. 봄에 파란 싹이 올라올 때 찻잎을 바라보고 있노라면 생명에 대한 한없는 경외감이 생긴다. 파란색은 생명의 색깔이기 때문이다. 겨울에도 차밭은 푸르다. 눈 속에서 찻잎의 파란색을 보면 차의 강인함과 싱싱함을 연상하게 된다. 이런 느낌 속에 자주 있다 보면 물아일체(物我一體)의 사상을 이해하게 된다고. 동양 식자층의 염원이 대자연과 일체가 되는 물아일체였다. 유한한 인생의 슬픔을 극복하게 해주는 치료제가 물아일체였다. 어떻게 대자연과 일체감을 얻을 수 있는가? 이것이 곧 구원이기도 하였다.차가 지닌 이러한 수양적 측면, 즉 정신적 측면을 파고들어 가면 과학적 성분분석에 눈이 간다. 바로 카테킨, 테아닌, 카페인이라고 하는 3대 성분이다. 카테킨은 항산화작용을 한다. 활성산소를 없애주는 작용이다. 노화방지도 된다. 테아닌은 마음을 차분하게 안정시켜 주는 작용을 한다. 카페인은 각성시켜 준다. 사물을 명료하게 인식하게 해주는 작용이다. 동양사상에서 말하는 적적성성(寂寂惺惺)의 경지가 있다. 마음이 아주 차분하게 가라앉아 고요하면서도 동시에 사물의 이치가 분명하게 들어오는 상태를 가리킨다. 차가 지닌 3대 성분이 복합작용을 하면 ‘적적성성’의 상태로 쉽게 들어갈 수 있다.한국 녹차는 이 3대 성분 가운데 테아닌의 성분이 특히 우수하다고 한다. 세계 어디에 내놓아도 뒤지지 않는 약성을 지니고 있는 것이 한국 녹차라는 게 최성민의 주장이다. 인삼도 고려인삼이 최고였듯이 녹차도 한국 녹차가 광물질 성분이 많이 녹아 있는 한국토양에서 자라기 때문에 약성도 뛰어나다는 것이다.  과학적 성분 분석이 아닌 일반적인 느낌 수준에서 차를 평가하는 기준이 있다. 바로 색(色), 향(香), 미(味)다. 물을 너무 뜨겁게 끓여도 색향미가 사라질 수 있고, 끓여 나온 차를 너무 늦게 마셔도 역시 사라질 수 있다.   ‘산절로 야생다원’의 차는 팔지 않는다. 비상업적이다. 야생차밭 4만평에서 무료 제다체험 행사를 체험객들에게 개방한다. 체험객들이 스스로 차를 만들도록 한다. 한국 전통차의 우수성을 홍보하기 위하여 돈을 받지 않고 주변에 선물한다. “뭘 먹고 사나?” “올해에는 문화재청에서 지원을 받았다. 무료 전통제다·수양다도 체험 프로그램 ‘차산(茶山)의 다정(茶庭) 다담(茶感)’이 그것이다. 이걸로 연명하고 있다. 굶어죽지는 않는다.” 한국에 이런 기인들이 있어서 차맥이 끊어지지 않는 모양이다.
1억 넣으면 10년 뒤 1.4억? 정부, 개인투자용 국채 발행한다;/news/articleView.html?idxno=28773;'국채(國債)'는 그동안 기관투자자나 고액 자산가들만 투자할 수 있는 것으로 인식돼왔다. 그만큼 접근성이 떨어지는 투자처였다. 하지만 내년 상반기부터는 상황이 달라진다. 개인투자자들이 손쉽게 국채에 투자할 수 있는 길이 열리기 때문이다. 정부는 9월 5일 열린 국무회의에서 개인투자용 국채 도입을 위한 '국채법 시행령 일부개정령안'을 심의·의결했다. 개인투자용 국채는 매입 자격을 개인으로 한정하는 저위험 중수익 상품이다. 저축성 국채로 안정적인 투자처를 원하는 사람에게 어울리는 상품이다. 장기적인 안목에서 자산형성을 하려는 사람들에게 선택지가 하나 더 늘어난 셈이다. 현재 국채 발행량의 대부분을 소화하는 곳은 금융기관이다. 이번 조치는 수요 다변화가 필요하다는 지적에 대한 해법도 될 수 있다. 개인투자용으로 국채 매입을 하려면 전용계좌를 개설하면 된다. 판매대행기관 창구를 직접 방문하거나 온라인 신청을 통해 청약·구매할 수 있다. 최소 투자금액은 10만원, 1인당 구매 한도는 연간 1억원이다. 개인투자용 국채는 10년물과 20년물, 두 종류를 발행한다. 당초 20년물 하나만 나올 것이라는 전망이 있었지만 만기가 너무 길어 심리적 장벽이 높을 수 있다는 지적이 있었다. 10년물을 추가하면서 그런 우려는 어느 정도 해소됐다. 중도환매, 상속도 가능해정부는 이번 개인투자용 국채를 '손실 위험 없는 원리금 보장형 상품'이라고 설명한다. 개인투자자가 국채를 만기까지 보유할 경우 표면금리 및 가산금리에 연복리를 적용한 이자를 원금과 함께 지급받게 된다.올해 1~7월 국고채 10년·20년물 낙찰금리 평균인 3.5%를 표면금리로 가정했을 때, 10년물을 1억원 매입하면 10년 뒤 약 1억4000만원을, 20년물을 1억원 매입하면 20년 뒤 약 2억원을 수령할 수 있다. 자녀 학자금이나, 결혼자금, 노후 대비 등 다양한 용도로 국채 투자를 활용할 수 있게 됐다. 매입 1년 뒤부터는 중도환매 신청이 가능하다. 이럴 경우 표면금리에 단리만 적용한다. 채권의 소유권 이전은 불가능하지만 국채를 구입한 사람이 만기 전 사망한다면 배우자나 자녀가 상속받을 수 있도록 할 방침이다. 개인이 이렇게 소유권을 넘겨받아 만기까지 보유할 경우 가산금리·복리·세제 혜택 등은 그대로 적용된다. 정부는 이달 중 행정예고를 거쳐 '개인투자용 국채의 발행 및 상환 등에 관한 규정'을 제정하고 이후 판매대행기관 선정, 시스템 구축 등을 거쳐 내년 상반기부터 개인투자용 국채를 발행하겠다는 계획이다. ※주간조선 온라인 기사입니다.
