oid;aid;title;subContent;thumbnail;dateTime;content001;0014188991;전 여자테니스 1위 할레프, 도핑 위반 인정돼 4년 출전 정지;금지약물 록사두스타트 복용·생체여권 부정 의혹 모두 인정올해 31세…'무죄 판결' 늦어지면 사실상 은퇴 내몰릴 듯도핑 위반 인정된 할레프[AFP=연합뉴스](서울=연합뉴스) 안홍석 기자 = 메이저 테니스 대회 여자 단식에서 2차례 우승한 시모나 할레프(31·루마니아)가 도핑 위반으로 4년 출전 정지 징계를 받아 선수 생명...;https://imgnews.pstatic.net/image/thumb154/001/2023/09/13/14188991.jpg;2023-09-13T08:33:01;"금지약물 록사두스타트 복용·생체여권 부정 의혹 모두 인정올해 31세…'무죄 판결' 늦어지면 사실상 은퇴 내몰릴 듯도핑 위반 인정된 할레프[AFP=연합뉴스](서울=연합뉴스) 안홍석 기자 = 메이저 테니스 대회 여자 단식에서 2차례 우승한 시모나 할레프(31·루마니아)가 도핑 위반으로 4년 출전 정지 징계를 받아 선수 생명 최대 위기를 맞았다.     국제테니스청렴기구(ITIA)는 비영리 단체 '스포츠 레졸루션즈'에 의뢰해 구성한 독립 재판소가 할레프의 도핑 의혹을 사실로 인정하고 4년 출전 정지 징계를 내렸다고 13일 밝혔다.    할레프는 지난해 US오픈에서 이뤄진 도핑 검사에서 금지 약물인 록사두스타트를 복용한 흔적이 발견돼 잠정적으로 출전 정지 징계를 받은 바 있다.     이어 올해 5월에는 그의 선수생체여권(ABP)을 분석한 결과 금지 약물을 투여했다는 의혹이 추가로 제기됐다.    독립 재판소는 지난 6월 28~29일 영국 런던에서 할레프와 ITIA 측이 증인으로 내세운 도핑 전문가들의 의견을 청취한 결과 할레프를 향한 두 의혹을 모두 사실로 인정한다고 판결했다.     독립 재판소는 ""약물에 오염된 보충제를 복용했다는 할레프 측의 주장은 인정하지만, 그게 록사두스타트 농도에는 영향을 미치지 않았을 것이다. 또 ABP에서 발견된 증거가 도핑 가능성을 입증한다는 전문가 3인의 만장일치 의견에 대해 의심할 이유도 없다""고 판결 이유를 설명했다.도핑 위반 인정된 할레프[AP=연합뉴스]    할레프는 이번 판결에 대해 스포츠중재재판소(CAS)에 항소하겠다는 뜻을 밝혔다.    할레프는 ""난 테니스를 지배하는 규칙을 매우 진지하게 받아들여 왔고, 고의적, 의도적으로 금지 약물을 사용한 적이 없다. 4년 출전 정지라는 결정을 받아들이지 않겠다""고 말했다.     이어 ""2022년 북미 하드코트 시즌을 앞두고 영양 보충제를 조정하는 과정에서 추가한 보충제가 록사두스타트에 오염된 사실을 나중에 확인했다""면서 ""문제의 회사에 법적 책임을 묻는 모든 방안을 강구하겠다""고 말했다.    할레프는 또 ""거의 20년 동안 수백 개의 대회에 출전해 두 번의 메이저 대회 타이틀을 거머쥐는 동안 금지 물질을 확인하기 위해 200번의 혈액 및 소변 검사를 받았지만 모두 깨끗했다""고 강조했다.    할레프는 투어 대회에서 통산 24차례 우승한 톱 레벨의 스타 플레이어다.    메이저 대회에서는 2018년 프랑스오픈, 2019년 윔블던에서 총 2차례 단식 우승을 차지했다. 2018년 프랑스오픈에서 우승하던 할레프[AFP=연합뉴스]    2017년부터 2년 연속으로 여자프로테니스(WTA) 단식 랭킹에서 연말 1위에 올랐다.    하지만 이번 도핑 위반 판결로 선수 생명 최대의 위기를 맞았다.    나이가 30대에 접어들었기 때문에 CAS에서 '무죄 판결'을 빨리 받지 못한다면 사실상 은퇴로 내몰리게 될 가능성이 커 보인다.    할레프는 연이은 부상에 지난해 초 은퇴를 고려하고 있다고 밝힌 적이 있다.     할레프 정도로 높은 수준의 선수가 도핑 위반으로 적발된 것은 2016년 마리야 샤라포바(은퇴·러시아) 이후 처음이다.     당시 2년 자격 정지 징계를 받은 샤라포바는 CAS에 항소했고, 재판부는 고의적인 도핑으로 보기 어렵다며 징계 수위를 15개월로 낮췄다.     록사두스타트는 빈혈이나 콩팥에 문제가 있는 환자들에게 처방하는 약물로, 적혈구 생산을 늘리는 기능을 한다.    도로 사이클, 장거리 육상 등 심폐지구력이 필요한 종목 선수들이 이 약물 복용으로 적발되곤 한다.     ahs@yna.co.kr"
021;0002593790;한국, 데이비스컵 1차전 세르비아에 패배…조코비치 출전 안 해;남지성(세종시청·오른쪽)과 송민규(KDB산업은행)가 12일(한국시간) 스페인 발렌시아에서 열린 데이비스컵 파이널스 C조 조별리그 1차전 복식에서 공을 리턴하고 있다. EPA 연합뉴스 한국이 2023 데이비스컵 파이널스 첫 경기에서 패했다.한국대표팀은 12일(한국시간) 스페인 발렌시아에서 열린 C조 조별리그 1차전에서 세르...;https://imgnews.pstatic.net/image/thumb154/021/2023/09/13/2593790.jpg;2023-09-13T08:31:03;남지성(세종시청·오른쪽)과 송민규(KDB산업은행)가 12일(한국시간) 스페인 발렌시아에서 열린 데이비스컵 파이널스 C조 조별리그 1차전 복식에서 공을 리턴하고 있다. EPA 연합뉴스  한국이 2023 데이비스컵 파이널스 첫 경기에서 패했다.한국대표팀은 12일(한국시간) 스페인 발렌시아에서 열린 C조 조별리그 1차전에서 세르비아에 매치점수 0-3으로 패했다. 세르비아의 노바크 조코비치(세계랭킹 1위)는 체력을 회복하기 위해 출전하지 않았다. 조코비치는 11일 테니스 메이저대회 US오픈 정상에 올라 역대 메이저대회 최다우승(24회) 타이기록을 작성했다.데이비스컵은 테니스의 월드컵으로 불린다. 남자테니스 국가대항전이다. 데이비스컵 파이널스는 지역 예선을 통과한 16개국이 참가, 4개 조로 나뉘어 조별리그를 펼치고 조 1, 2위가 8강에 진출한다. 한국은 사상 처음으로 데이비스컵 파이널스에 2년 연속 진출했다.1단식에서 홍성찬(세계 194위·세종시청)은 두산 라요비치(52위)에 0-2(4-6, 6-7)로, 2단식에서 간판인 권순우(112위·당진시청)는 라슬로 제레(37위)에 1-2(6-4, 2-6, 2-6)로 졌다. 복식에선 남지성(복식 126위·세종시청)-송민규(185위·KDB산업은행)가 니콜라 카치치(62위)-미오미르 케츠마노비치(184위)에 1-2(6-3, 4-6, 6-7)로 패했다.대표팀은 14일 밤 10시 체코와 2차전을 벌인다. 마지막 3차전(17일) 상대는 스페인이다.
241;0003300474;사이클 베테랑 이혜진·박상훈의 다짐 “나 자신과 후배들을 위해”;"사이클 단거리 베테랑 이혜진이 자신의 네 번째 아시안게임을 앞뒀다. 사진=대한자전거연맹한국 사이클 트랙 단거리&middot;중장거리 베테랑 이혜진(31&middot;서울시청)과 박상훈(30&middot;의정부시청)이 항저우 아시안게임(AG)을 앞두고 &ldquo;나 자신과 후배들을 위해 대회에 나선다&rdquo;는 각오를...";https://imgnews.pstatic.net/image/thumb154/241/2023/09/13/3300474.jpg;2023-09-13T08:30:02;사이클 단거리 베테랑 이혜진이 자신의 네 번째 아시안게임을 앞뒀다. 사진=대한자전거연맹한국 사이클 트랙 단거리·중장거리 베테랑 이혜진(31·서울시청)과 박상훈(30·의정부시청)이 항저우 아시안게임(AG)을 앞두고 “나 자신과 후배들을 위해 대회에 나선다”는 각오를 전했다. 한국 사이클은 지난 2018 자카르타-팔렘방 AG 당시 금메달 6개·은메달 3개·동메달 4개로 역대 최고 성적을 올렸다. 여자부 중장거리 간판 나아름이 당해 금메달 4개를 싹쓸이한 것을 포함, 20대 중반의 선수들이 대거 메달 레이스에 합류했다.트랙 단거리에서는 이혜진, 중장거리에서는 박상훈이 빛났다. 이혜진은 2014 인천 AG 은메달 1개(단체 스프린트)에 이어 2018 자카르타-팔렘방에서 은메달 2개(스프린트·경륜) 동메달 1개(단체스프린트)를 목에 걸었다. 2020년 3월 세계트랙사이클선수권대회에선 한국 최초로 은메달을 따내며 여자 경륜 세계랭킹 1위에 오르기도 했다. 사이클 트랙 중장거리 베테랑 박상훈이 다시 한번 아시안게임 메달을 노린다. 사진=대한자전거연맹박상훈은 2014 인천 AG 은메달(단체추발)을 시작으로 2018 자카르타 AG 금메달(개인추발) 은메달(매디슨)을 목에 걸었다. 두 선수 이후 꾸준히 대회 상위 랭킹에 이름을 올렸고, 이제는 30대의 나이에 AG을 맞이한다.대회를 앞둔 두 선수는 본지와 통화에서 이번 목표에 대해 “후배들의 발전을 위해”라고 입을 모았다. 먼저 박상훈은 “내 동기들은 모두 은퇴했다. 나 역시 이번 AG를 앞두고 허리와 무릎 부상을 입어 준비하기 쉽지 않았다. 이런 큰 시합은 사실상 마지막이 아닐까”라면서도 “향후 지도자를 생각하고 있다. 지도자 자격증도 있지만, 아직 선수 생활을 그만두고 싶지 않다. 어쨌든 지도자가 선수를 이해하려면, 사이클을 계속해야 한다고 본다. 내 후배들을 무조건 나보다 잘 타야 한다”고 힘줘 말했다. 실제로 그는 자신과 함께한 후배 장훈을 자신의 바로 밑까지 키웠다며 당당히 말하기도 했다. 장훈 역시 박상훈과 함께 항저우 AG에 나선다.이혜진은 “사실 그동안 나 혼자의 레이스에만 집중했지만, 지금은 새로운 재미를 깨달았다. 재작년 동료, 후배들에게 운동 방법을 알려줬는데 이들이 성장하는 걸 보며 즐거웠다. 동생들에게 잘 알려주기 위해 사이클을 잘 타고 싶다는 새로운 동기부여가 생겼다”고 돌아봤다. 그는 이어 “원래 30세 때 지도자로 전향하려고 했는데, 지금은 내가 선수 생활을 하며 후배들과 함께하는 게 더 낫다고 본다. 지도자와 선수가 동료들을 보는 시각이 조금 다르다”고 설명했다.두 선수 제2의 인생은 다를지라도, 후배들을 걱정하는 마음은 같았다. 끝으로 이들에게 항저우 AG 전망을 묻자 이혜진은 “최선을 다하겠다”고 답했고, 박상훈은 “일본이 강적으로 꼽히지만, 그래도 일본한테 지는 건 말이 안 된다고 생각한다”고 강조했다.김우중 기자
011;0004237584;한국 테니스, 데이비스컵서 세르비아에 완패;2023 데이비스컵 파이널스 세르비아전에 나선 권순우. 로이터연합뉴스[서울경제] 한국 남자 테니스 대표팀이 국가대항전인 2023 데이비스컵 파이널스 첫판에서 세르비아에 졌다.한국은 12일(한국 시간) 스페인 발렌시아에서 열린 대회 조별리그 C조 1차전에서 세르비아에 매치 점수 0대3으로 패했다. 사상 처음으로 16개국이...;https://imgnews.pstatic.net/image/thumb154/011/2023/09/13/4237584.jpg;2023-09-13T08:17:01;0대3 패···14일 체코와 2차전2023 데이비스컵 파이널스 세르비아전에 나선 권순우. 로이터연합뉴스[서울경제] 한국 남자 테니스 대표팀이 국가대항전인 2023 데이비스컵 파이널스 첫판에서 세르비아에 졌다.한국은 12일(한국 시간) 스페인 발렌시아에서 열린 대회 조별리그 C조 1차전에서 세르비아에 매치 점수 0대3으로 패했다. 사상 처음으로 16개국이 출전하는 데이비스컵 파이널스에 2년 연속 오른 한국은 첫 승을 올리지 못해 각 조 상위 2개 팀이 오르는 8강 토너먼트 진출도 어려워졌다.한국은 1단식에 홍성찬(194위·세종시청), 2단식에 권순우(112위·당진시청), 복식에 남지성(복식 126위·세종시청)-송민규(복식 185위·KDB산업은행) 조를 내보냈다. 세르비아는 이틀 전 끝난 US오픈에서 메이저 최다 24회 우승을 이뤄낸 노바크 조코비치(1위)가 휴식을 취한 가운데 두산 라요비치(52위), 라슬로 제레(37위), 니콜라 카치치(복식 62위)-미오미르 케츠마노비치(복식 184위) 조를 차례로 배치했다.1단식에 나선 홍성찬은 라요비치를 상대로 잘 싸웠지만 0대2(4대6 6대7<3대7>)로 졌다. 2단식에서는 권순우가 통산 전적 1승 1패를 기록 중이던 제레를 상대로 우세하게 경기를 시작했지만 1대2(6대4 2대6 2대6)로 역전패했다. 승부가 이미 갈린 상황에서 치러진 마지막 복식에서 남지성-송민규 조는 3세트 타이브레이크까지 가는 승부 끝에 1대2(6대3 4대6 6대7<5대7>)로 졌다.한국은 한국 시간으로 14일 밤 10시 체코를 상대로 첫 승 사냥에 재도전한다.
410;0000958142;국민체육진흥공단 이사장배 전국카누대회 개최;국민체육진흥공단(이사장 조현재) 경륜경정총괄본부가 9월 9∼11일 충청남도 부여군 백제호 카누경기장에서 국민체육진흥공단 이사장배 전국카누대회를 개최했다.이번 대회는 국민체육진흥공단 경륜경정총괄본부가 주최하고 대한카누연맹이 주관하였으며, 전국 16개 시도 233명의 선수가 참여, 남녀 중·고등부, 대학부, 일반부로 나뉘어...;https://imgnews.pstatic.net/image/thumb154/410/2023/09/13/958142.jpg;2023-09-13T08:02:01;국민체육진흥공단(이사장 조현재) 경륜경정총괄본부가 9월 9∼11일 충청남도 부여군 백제호 카누경기장에서 국민체육진흥공단 이사장배 전국카누대회를 개최했다.이번 대회는 국민체육진흥공단 경륜경정총괄본부가 주최하고 대한카누연맹이 주관하였으며, 전국 16개 시도 233명의 선수가 참여, 남녀 중·고등부, 대학부, 일반부로 나뉘어 뜨거운 경쟁을 펼쳤다.정철락 경륜경정사업본부장은 “어느덧 올해로 14회째를 맞은 이 대회가 카누 종목 경기력 향상 및 생활체육으로서 저변 확대에 이바지한 바가 크다”며 참가선수들의 안전과 건투를 당부했다. 경륜경정총괄본부 정철락 경륜경정사업본부장이 개회사를 하고 있다. 사진=국민체육진흥공단 경륜경정총괄본부 제공국민체육진흥공단은 자체적으로 카누 선수단을 운영하고 있으며 우수 선수 육성 및 전국대회 개최를 통한 카누 경기력 향상에 크게 기여하고 있다.
055;0001089319;'가자 항저우로!'…결단식서 선전 다짐;항저우 아시안게임 개막이 딱 열흘 앞으로 다가왔습니다.우리 선수단은 어제(12일) 결단식을 갖고 선전을 다짐했습니다.산뜻한 단복을 입고 한자리에 모인 선수들은 함께 기념사진을 찍으며 팀워크를 다지고 추억을 만들었습니다.최윤 선수단장이 대형 태극기를 힘차게 흔들자 다 같이 선전을 다짐했습니다.[안세영/배드민턴 국가대표 :...;https://imgnews.pstatic.net/image/thumb154/055/2023/09/13/1089319.jpg;2023-09-13T07:49:18;항저우 아시안게임 개막이 딱 열흘 앞으로 다가왔습니다.우리 선수단은 어제(12일) 결단식을 갖고 선전을 다짐했습니다.산뜻한 단복을 입고 한자리에 모인 선수들은 함께 기념사진을 찍으며 팀워크를 다지고 추억을 만들었습니다.최윤 선수단장이 대형 태극기를 힘차게 흔들자 다 같이 선전을 다짐했습니다.[안세영/배드민턴 국가대표 : 자신감도 얻고 더 좋은 시너지도 얻고 가는 것 같아요. 충분히 아시안게임도 잘할 수 있을 것이라고 생각하고 있습니다.][황선우/수영 국가대표 : 제 개인 최고 기록을 경신하는 것이 가장 큰 목표이기 때문에 좋은 기록과 좋은 성적으로 보답해 드리고 싶어요.]우리나라는 39개 종목에 걸쳐 1,140명 규모의 선수단을 파견하고, 개막 사흘 전인 오는 20일에 선수단 본진이 항저우에 입성합니다.(영상취재 : 박승원, 영상편집 : 이정택)
468;0000979812;47억 아시아인의 축제? 한국 스포츠에 항저우는 거대한 ‘시험대’ [AG D-10];2022 항저우 아시안게임 주경기장 전경. 사진 | 항저우=AFP연합뉴스[스포츠서울 | 김동영기자] ‘47억 아시아인의 축제’가 돌아왔다. 2022 항저우 아시안게임이 열흘 후 개막한다. 한국 스포츠는 마냥 즐길 수 없는 처지다. ‘국제 경쟁력’이 떨어지고 있다는 평가가 계속 나오는 탓이다. 이번 대회는 ‘시험대’다.이번...;https://imgnews.pstatic.net/image/thumb154/468/2023/09/13/979812.jpg;2023-09-13T07:41:02;[스포츠서울 | 김동영기자] ‘47억 아시아인의 축제’가 돌아왔다. 2022 항저우 아시안게임이 열흘 후 개막한다. 한국 스포츠는 마냥 즐길 수 없는 처지다. ‘국제 경쟁력’이 떨어지고 있다는 평가가 계속 나오는 탓이다. 이번 대회는 ‘시험대’다.이번 2022 항저우 아시안게임은 19번째 대회로 오는 23일 중국 항저우에서 개막한다. 애초 지난해 열렸어야 했던 대회다. 코로나 팬데믹으로 인해 1년 연기되면서 올해 개최된다. 이례적으로 5년 만에 열리는 아시안게임이다.아시아올림픽평의회(OCA) 산하 45개국에서 약 1만2500명의 선수가 참가해 치열한 경쟁을 펼칠 예정이다. 각국 선수단은 23일부터 10월8일까지 40개 정식종목, 61개 세부 종목에서 총 481개 금메달을 놓고 각축전을 벌인다. 한국은 선수, 코치를 포함해 역대 최다인 1180명의 선수단을 파견한다.한국은 기본적으로 아시아의 스포츠 강국이다. 아시안게임에서는 중국-일본과 함께 대회를 주름잡았다. 특히 1998 방콕 대회부터 2014 인천 대회까지 5년 연속으로 종합 순위 2위에 자리했다.‘넘사벽’ 중국은 어쩔 수 없는 상황. 사실상 한국이 오를 수 있는 최고 순위가 2위다. 일본과 치열한 경쟁을 펼쳤다. 1994 히로시마 대회 이후 계속 한국이 우위에 섰다.이 흐름이 2018 자카르타-팔렘방 대회에서 끊어졌다. 일본에 밀려 종합 3위가 됐다. 애초에 넘보기 어려운 중국에다, 일본의 약진까지 나왔다. 한국은 중국의 쫓아가지도, 일본을 뿌리치지도 못했다.메달 숫자가 말해준다. 한국은 금메달 49개, 은메달 58개, 동메달 70개를 땄다. 일본은 금메달만 75개에 달한다. 은메달 65개, 동메달 74개다.2014 인천 대회 당시 한국이 금메달 79개, 일본이 금메달 47개였다. 2010 광저우 아시안게임에서도 한국과 일본의 금메달 개수는 각각 76개와 48개였다.2018년 자카르타-팔렘방에서 완전히 뒤집혔다. 금메달 70개를 목표로 놓고 참가했는데, 50개도 따지 못했다. ‘참사’ 소리가 나올 법했다.사실 일본이 ‘작정하고’ 나선 대회다. 2020 도쿄 올림픽을 앞두고 엘리트 체육 육성에 팔을 걷어붙였다. 진천선수촌을 직접 보기 위해 한국까지 오기도 했다.2018 아시안게임을 올림픽 ‘전초전’으로 놨다. 생활체육으로 다진 저변에 엘리트 육성이 더해지니 결과도 따라왔다. 이후 2021년 열린 올림픽에서도 금메달 27개, 은메달 14개, 동메달 17개를 따내며 종합 3위에 올랐다. 일본의 역대 최고 성적을 냈다.한국은 상황이 다르다. 엘리트 위주로 성장했는데, 2016년부터 엘리트-생활체육 통합에 나섰다. 대한체육회와 국민생활체육회를 합쳐 통합 대한체육회로 출범했다.생활스포츠 기반으로 엘리트를 육성한다는 계획이다. 장기적으로 필요한 부분이기는 했다. 이후 분명히 좋아진 부분도 있다. 그러나 전체적으로 ‘한국 체육이 제대로 돌아가지 않는다’는 목소리가 작지 않다. 혼란한 와중에 2018년 아시안게임에 나섰고, 초라한 성적을 냈다.이번 항저우 대회에서 한국은 금메달 50개를 목표로 놨다. 종합 3위가 예상된다. 지난 대회보다 목표 금메달부터 20개가 빠졌다. 그만큼 전력이 약해졌고, 다른 나라가 강해졌다는 의미다.이번 아시안게임이 끝이 아니다. 바로 1년 후 2024 파리 올림픽이 열린다. 올림픽을 위해서라도 이번 대회에서 선전할 필요가 있다. 더 길게 보면 생활체육을 바탕으로 하더라도, 엘리트 체육이 밀리지 않는다는 점도 보여줘야 한다.한 현직 KBO리그 감독은 “당장 야구도 예전만 못하다는 말이 나오지 않나. 생활체육 살리겠다고 엘리트를 소홀히 하는 것 아닌가 싶다. 국제종합대회에서 성적이 계속 안 좋으면 다시 엘리트 위주로 가자는 말이 또 나올 것이다. 제대로 잘 돌아갔으면 하는 바람이다”며 쓴소리를 남겼다.어쨌든 대회는 코앞으로 다가왔다. 12일 올림픽공원 올림픽홀에서 열린 2022 항저우 아시안게임 대한민국 선수단 결단식에서 대한체육회 이기흥 회장은 “이번 대회는 대한민국 스포츠의 새로운 출발점이 될 것이다”고 강조했다.외부 환경과 별개로 선수들은 진천선수촌을 비롯해 각자의 자리에서 구슬땀을 흘렸다. 최선을 다해 성과를 내는 것만 남았다. 그 성과를 바탕으로 한국 스포츠의 미래를 정밀하게 다시 그려야 한다. raining99@sportsseoul.com
421;0007046267;한국 테니스, 데이비스컵서 조코비치 빠진 세르비아에 완패;데이비스컵에출전한 한국 복식조의 남지성-송민규. ⓒ AFP=뉴스1(서울=뉴스1) 김도용 기자 = 한국이 테니스 국가대항전 데이비스컵 파이널스 첫 경기에서 완패를 기록했다. 한국은 12일(이하 한국시간) 스페인 발렌시아에서 펼쳐진 세르비아와의 2023 데이비스컵 파이널스 C조 조별리그 1차전에서 0-3으로 졌다.최초로 2년...;https://imgnews.pstatic.net/image/thumb154/421/2023/09/13/7046267.jpg;2023-09-13T07:36:57;0-3으로 져데이비스컵에출전한 한국 복식조의 남지성-송민규. ⓒ AFP=뉴스1(서울=뉴스1) 김도용 기자 = 한국이 테니스 국가대항전 데이비스컵 파이널스 첫 경기에서 완패를 기록했다. 한국은 12일(이하 한국시간) 스페인 발렌시아에서 펼쳐진 세르비아와의 2023 데이비스컵 파이널스 C조 조별리그 1차전에서 0-3으로 졌다.최초로 2년 연속 데이비스컵 본선행에 성공한 대표팀은 세르비아의 높은 벽을 넘지 못하면서 첫 경기서 패했다. 조별리그 2위까지 주어지는 데이비스컵 파이널 진출도 어려워졌다. 한국은 1단식에 홍성찬(194위‧세종시청), 2단식에 권순우(112위‧단진시청)을 내세웠다. 복식에는 남지성(복식 126위·세종시청)-송민규(복식 185위·KDB산업은행) 조가 출전했다.세르비아는 직전 US오픈에서 우승을 차지한 노박 조코비치(1위)에게 휴식을 부여했다. 대신 두산 라요비치(52위)가 1단식, 라스로 제레(37위)가 2단식에 나섰다. 복식에서는 니콜라 카치치(복식 62위)-미오미르 케츠마노비치(복식 184위)가 한 조를 이뤘다. 1단식에 나선 홍성찬은 라요비치를 상대로 잘 싸웠지만 0-2(4-6 6-7)로 졌다.권순우는 통산 전적 1승1패를 기록 중이던 제레를 상대로 분전했지만 1-2(6-4 2-6 2-6)로 역전패했다.권순우는 1세트에 제레가 잦은 실수를 범하자 이를 놓치지 않고 격차를 벌렸다. 또한 상대의 4번째 서브 게임을 가져오면서 기선 제압에 성공했다. 그러나 2세트부터 제레의 플레이가 살아나면서 흐름을 내줬다. 결국 권순우는 2세트와 3세트를 연달아 내주면서 고개를 숙였다. 마지막 복식에서 남지성-송민규 3세트 타이브레이크까지 가는 전전을 펼쳤지만 1-2(6-3 4-6 6-7)로 졌다.한국은 오는 14일 오후 10시 체코와 조별리그 2차전을 펼친다.'테니스 월드컵'으로 불리는 데이비스컵 본선은 총 16개 팀이 출전, 4개 조로 나눠 경쟁한다. 각 조 상위 2개 팀이 11월 스페인 말라가에서 펼쳐지는 데이비스컵 파이널에 진출한다.
