oid;aid;title;subContent;thumbnail;dateTime;content001;0014190995;최병화, 양화대교 다이빙;(서울=연합뉴스) 류영석 기자 = '한국인 1호 하이다이빙 선수' 최병화가 13일 오후 서울 양화대교에서 열린 '레드불 서울다이브'에서 연기를 선보이고 있다. 2023.9.13 ondol@yna.co.kr;https://imgnews.pstatic.net/image/thumb154/001/2023/09/13/14190995.jpg;2023-09-13T16:12:17;(서울=연합뉴스) 류영석 기자 = '한국인 1호 하이다이빙 선수' 최병화가  13일 오후 서울 양화대교에서 열린 '레드불 서울다이브'에서 연기를 선보이고 있다. 2023.9.13    ondol@yna.co.kr
425;0000143809;日 '바둑 천재' 스미레, 내년부터 한국서 돌 잡을 듯;"일본의 '천재 바둑 소녀' 나카무라 스미레 3단 [한국기원 제공] 일본의 '천재 바둑 소녀' 나카무라 스미레 3단이 내년부터 한국에서 객원기사로 활동할 전망이다.13일 한국프로기사협회는 성동구 한국기원 사옥에서 대의원 회의를 열고 나카무라 3단의 객원기사 신청안을 통과시켰다고 밝혔다.대의원 회의에 참석한 관계자는 ""일단...";https://imgnews.pstatic.net/image/thumb154/425/2023/09/13/143809.jpg;2023-09-13T16:10:01;"일본의 '천재 바둑 소녀' 나카무라 스미레 3단 [한국기원 제공] 일본의 '천재 바둑 소녀' 나카무라 스미레 3단이 내년부터 한국에서 객원기사로 활동할 전망이다.13일 한국프로기사협회는 성동구 한국기원 사옥에서 대의원 회의를 열고 나카무라 3단의 객원기사 신청안을 통과시켰다고 밝혔다.대의원 회의에 참석한 관계자는 ""일단 프로기사들이 대승적 차원에서 나카무라의 합류를 받아들이기로 결정했다""라며 ""곧바로 나카무라를 한국기원에 객원기사로 추천할 예정""이라고 밝혔다.한국기원은 나카무라의 객원기사 승인안을 검토하고 10월 이후 열리는 이사회에서 최종적으로 결정한다.만 10세에 일본기원 역대 최연소 프로기사 기록을 세운 나카무라는 올 2월 여자기성전 우승으로 역대 최연소 타이틀 획득을 기록했다.나카무라는 실력 향상을 위해 한국행을 결심했고, 일본기원은 고심 끝에 지난달 초 한국기원에 객원기사로 추천했다.일본 여자기성 우승자인 나카무라는 내년 2월 타이틀 방어전을 치른 뒤 한국으로 건너올 예정이다."
370;0000008417;"프로기사 대의원회 ""스미레 한국 활동 찬성""";한국기원에서 활동하고 싶어하는 일본의 바둑 천재소녀 나카무라 스미레 3단. 한국기원 대의원회에서 객원기사 신청안이 통과됨으로써 탄력을 받게 됐다. ○●… 대의원회, 스미레 객원기사로 추천(한게임바둑=한창규 기자) 13일 오전에 열린 제35대 12차 대의원회에서 나카무라 스미레 3단(14)의 이적 요청에 관한 안건을 논의한...;https://imgnews.pstatic.net/image/thumb154/370/2023/09/13/8417.jpg;2023-09-13T16:04:19;"○●… 대의원회, 스미레 객원기사로 추천(한게임바둑=한창규 기자) 13일 오전에 열린 제35대 12차 대의원회에서 나카무라 스미레 3단(14)의 이적 요청에 관한 안건을 논의한 결과 객원기사 신청안을 통과시켰다. 대의원회는 주요 현안을 논의하고 결정하는 한국기원 소속 프로기사들의 세대별 대표가 모인 회의체이다.향후 한국기원은 15일의 운영위원회에서 객원기사 승인안을 검토한 데 이어 10월 말의 이사회에서 최종 결정할 예정이다.대의원회는 승인 절차 중의 첫 관문이지만 기사들의 중론이기 때문에 가장 중요하다고도 할 수 있다. 국내 여론도 상당히 우호적이어서 운영위원회, 이사회에서 이적 안건이 부결될 가능성은 희박해 보인다.일본의 천재 바둑소녀로 조명을 받고 있는 나카무라 스미레 3단은 객원기사 신청안이 최종 통과되면 내년 3월부터 한국기원 소속으로 활동하게 될 전망이다.○●… 이창석, 명인전 부활 시동13일 오후 K바둑 스튜디오에서 열린 제46기 SG배 명인전에서 이창석 9단이 윤민중 4단을 꺾고 패자조 2회전에 진출했다. 상대전적 1승1패에서의 대결은 2시간 40분, 169수 만의 불계승으로 갈렸다. ""초반에 연구했던 모양이 나와서 약간 편하게 시작했다""는 이창석 9단의 국후 이야기. 랭킹은 이창석 9단이 15위, 윤민중 4단이 136위.이창석 9단은 변상일-박종훈이 벌이는 승자조 8강전 패자와 대결한다. 명인전에서 이창석은 44기 8강 멤버이다.명인전 본선이 처음인 윤민중 4단은 2패째를 당하며 첫 시즌을 마감했다.패자부활전을 병행하는 16강 토너먼트에 이어 결승3번기로 우승자를 가리는 제46기 SG배 명인전의 상금은 우승 7000만원, 준우승 2500만원이다. 14일에는 한상조-김채영, 15일에는 이창호-나현의 패자조 1회전이 이어진다.○●… 난설헌배 전국여자바둑대회 예선12~13일 한국기원에서 열린 2023 난설헌배 전국여자바둑대회 예선에서 조승아 6단(5위, 이하 여자랭킹), 김혜민 9단(8위), 허서현 4단(13위), 김다영 5단(15위), 박소율 3단(19위), 강다정 3단(24위), 이나경 초단(29위), 김신영 2단(34위)이 본선에 진출했다.전기 대회까지 8강전으로 치렀던 본선은 올해 12강전으로 변경했다. 전기 우승자인 김은지 6단, 그리고 상위랭커 오유진 9단과 김채영 8단은 시드로 직행한다(최정 9단은 매년 불참하고 있다). 여기에 건강 문제로 불참하는 전기 준우승자 김윤영 5단을 대체해서 와일드카드 1명이 합류한다.강릉시가 후원하는 난설헌배는 이번이 세 번째 시즌. 본선은 10월 21~22일 강릉 현지에서 진행할 예정이다. 상금은 우승 2000만원, 준우승 800만으로 전기 대비 각각 500만원, 100만원 증액됐다.☞ 2023 난설헌배 예선 대진"
382;0001075209;한국계 부인 둔  NFL 구단주 “흑인 아프리카로 돌아가 말한 적 없다”;테리·킴 페굴라 부부. 사진=게티이미지코리아.부인이 한국계인 미국프로미식축구리그(NFL) 버펄로 빌스의 구단주 테리 페굴라(72)가 리그의 흑인 선수들을 대상으로 인종차별적 발언을 했다는 의혹을 부인했다.ESPN, 가디언 등의 보도에 따르면 페굴라 구단주의 인종차별 발언 주장은 NFL 미디어에 종사했던 흑인 언론인 짐 트...;https://imgnews.pstatic.net/image/thumb154/382/2023/09/13/1075209.jpg;2023-09-13T16:03:03;테리·킴 페굴라 부부. 사진=게티이미지코리아.부인이 한국계인 미국프로미식축구리그(NFL) 버펄로 빌스의 구단주 테리 페굴라(72)가 리그의 흑인 선수들을 대상으로 인종차별적 발언을 했다는 의혹을 부인했다.ESPN, 가디언 등의 보도에 따르면 페굴라 구단주의 인종차별 발언 주장은 NFL 미디어에 종사했던 흑인 언론인 짐 트로터가 제기한 소송을 통해 드러났다. 트로터는 NFL 경영진, 코치 및 언론인들 사이의 다양성 부족에 대한 우려를 제기한 후 미움을 사 올해 NFL 네트워크와 재계약에 실패했다며 소송을 제기했다.53페이지에 달하는 소장의 한 부분에서 트로터는동료 기자가 페굴라의 인종차별 발언을 목격했다고 주장했다. “흑인 선수들은 이곳이 마음에 들지 않으면 아프리카로 돌아가서 거기가 얼마나 나쁜지 봐야 한다”고 말했다는 것.문제의 발언은 NFL 선수들이 미국의 인종차별에 항의하는 시위(블랙 라이브 매터·흑인의 생명도 소중하다)를 벌이던 2020년에 나왔다고 그는 주장했다. 트로터는 NFL 미디어 경영진에게 페굴라의 발언의 진위에 관한 조사를 요청했지만 “리그 사무국에서 조사 중이라는 말만 반복해서 들었다”고 밝혔다.페굴라 구단주는 12일(현지시각) 인종차별 발언 의혹을 강하게 부인했다.테리·킴 페굴라 부부. 사진=게티이미지코리아.그는 성명을 통해 “트로터 씨의 고소장에 있는 나와 관련된 진술은 완전히 거짓”이라며 “누군가가 저를 이런 종류의 혐의와 연결 짓는다는 사실에 경악을 금치 못한다”라고 말했다. 그는 이어 “인종차별은 우리 사회에서 설 자리가 없으며, 제 이름이 이 고소 건과 연관되어 있다는 사실에 개인적으로 역겨움을 느낀다”고 덧붙였다.테리 페굴라의 부인인 킴 페굴라(54)는 한국계로 잘 알려졌다. 킴은 1969년 서울에서 태어났지만 다섯 살이었던 1974년 미국으로 입양됐으며 1993년 테리와 결혼했다. 페굴라 부부는 천연가스 개발, 엔터테인먼트 사업 등으로 큰 돈을 벌어 포브스 추정 자산이 67억 달러(약 8조 9110억 원)에 달한다. 이 부부는 버펄로 빌스와 북미아이스하키리그(NHL) 버펄로 세이버스의 구단주다. 또한 딸 제시카 페쿨라는 여자 테니스의 강자다. 현재 WTA 단식 세계랭킹 5위에 올라 있다.제시카 페굴라는 2019년 서울에서 열린 WTA 투어 코리아오픈에 출전해 “나는 하프 코리안”이라고 소개하기도 했다.
023;0003787604;NFL 전설 로저스, 제츠 데뷔전서 4분 뛰고 시즌 마감;12일 NFL 경기에서 레너드 플로이드에 태클을 당하는 애런 로저스. 그는 아킬레스건이 파열되며 올 시즌을 마감했다. / USA투데이 연합뉴스 NFL(미 프로풋볼) 뉴욕 제츠는 뉴욕을 연고로 한 미국 4대 프로스포츠(미식축구·야구·농구·아이스하키) 9팀 중 가장 오랜 시간 우승을 하지 못한 팀이다. 1969년 수퍼볼이 유...;https://imgnews.pstatic.net/image/thumb154/023/2023/09/13/3787604.jpg;2023-09-13T16:01:05;12일 NFL 경기에서 레너드 플로이드에 태클을 당하는 애런 로저스. 그는 아킬레스건이 파열되며 올 시즌을 마감했다. / USA투데이 연합뉴스NFL(미 프로풋볼) 뉴욕 제츠는 뉴욕을 연고로 한 미국 4대 프로스포츠(미식축구·야구·농구·아이스하키) 9팀 중 가장 오랜 시간 우승을 하지 못한 팀이다. 1969년 수퍼볼이 유일한 우승. 최근에도 AFC(아메리칸콘퍼런스) 동부지구 2위를 차지한 2010시즌을 끝으로 12년 연속 플레이오프에 진출하지 못했다. 2016년부터는 3위를 차지한 2019년을 제외하고 작년까지 매 시즌 동부지구 꼴찌(4위)에 머물렀다.그런 제츠가 올 시즌을 앞두고 희망을 한껏 부풀렸다. 그린베이 패커스 유니폼을 입고 4차례 정규리그 MVP에 선정된 레전드 쿼터백 애런 로저스(40)를 트레이드로 데려왔기 때문이다. 로저스는 MVP 수상 횟수에선 수퍼볼에서 7차례 정상에 선 ‘G.O.A.T(Greatest Of All Time·역대 최고 선수)’ 톰 브래디(3회)를 앞선다. 제츠는 로저스를 영입하기 위해 드래프트 지명권 4장을 패커스에 넘겼다.하지만 로저스와 함께 수퍼볼 정상에 도전하겠다는 제츠의 꿈은 2023시즌 첫 경기 시작 4분 만에 박살이 났다. 12일(한국 시각) 버펄로 빌스를 맞아 제츠 데뷔전에 나섰던 로저스는 상대 수비수인 레너드 플로이드의 태클에 쓰러졌다. 부축을 받고 나간 그는 검진 결과 왼쪽 아킬레스건이 파열됐다는 진단을 받았다. 올 시즌을 뛸 수 없는 것은 물론 불혹에 다다른 로저스의 나이로 볼 때 은퇴 기로에 섰다는 보도가 나온다. 로저스의 2023시즌 연봉은 약 490억원에 달한다.제츠는 12일 빌스를 상대로 연장 극적인 펀트 리턴 터치다운으로 22대16으로 이겼지만, 시즌 전망은 밝지 않다. 로저스를 대신할 주전 쿼터백 잭 윌슨(24)은 2021년 드래프트 전체 2순위로 제츠에 입단하며 기대를 모았지만, 지난 두 시즌 55.2%의 저조한 패스 성공률을 보이며 부진했다.
421;0007048267;송강영 동서대 교수, 한국스포츠정책과학원장 취임;송강영 한국스포츠정책과학원장(오른쪽) (KSPO 제공)(서울=뉴스1) 안영준 기자 = 국민체육진흥공단(KSPO)은 송강영 동서대학교 교수가 한국스포츠정책과학원 신임 원장에 취임했다고 13일 밝혔다. 송강영 신임 원장은 서울대학교 대학원에서 체육교육학 석사, 교육학 박사 학위를 취득한 후 2000년 동서대학교 교수로 부임했...;https://imgnews.pstatic.net/image/thumb154/421/2023/09/13/7048267.jpg;2023-09-13T15:55:55;"교육자 출신·체육 분야 전문지식 갖춰 2025년 9월까지 임기 2년송강영 한국스포츠정책과학원장(오른쪽) (KSPO 제공)(서울=뉴스1) 안영준 기자 = 국민체육진흥공단(KSPO)은 송강영 동서대학교 교수가 한국스포츠정책과학원 신임 원장에 취임했다고 13일 밝혔다. 송강영 신임 원장은 서울대학교 대학원에서 체육교육학 석사, 교육학 박사 학위를 취득한 후 2000년 동서대학교 교수로 부임했다. 이후 체육인재육성재단 이사장, 한국여가레크리에이션학회 회장, 한국체육학회 부회장, 한국융합과학회 회장 등을 역임해 체육 분야에 대한 깊은 지식과 다양한 경험을 바탕으로 국민체육진흥을 위한 체육정책 개발 및 스포츠 과학의 체계적 연구에 크게 기여할 적임자로 평가받고 있다. 송 원장은 ""대한민국 스포츠의 명실상부한 싱크탱크인 한국스포츠정책과학원의 신임 원장이 돼 어깨가 무겁다""면서 ""교육자, 행정가로서 느낀 경험을 살려 체육진흥에 힘쓰겠다""고 취임 소감을 밝혔다.송 원장의 임기는 2025년 9월12일까지 2년이다."
445;0000141892;'육상 카리나' 김민지, 실업단대항전 100m 예선 탈락...주종목 400m 기권;"진천군청 김민지, 김민지 SNS 계정(MHN스포츠 권수연 기자) &#39;육상 카리나&#39;로 불리는 김민지(진천군청)가 제34회 전국실업단대항육상경기대회에 출전해 예선 8명 중 7위에 올랐다.김민지는 지난 7일부터 9일까지 서천 종합운동장 육상경기장에서 열린 제34회 전국실업단대항육상경기대회에 출사표를 던졌다. 김민지...";https://imgnews.pstatic.net/image/thumb154/445/2023/09/13/141892.jpg;2023-09-13T15:55:01;"진천군청 김민지, 김민지 SNS 계정(MHN스포츠 권수연 기자) '육상 카리나'로 불리는 김민지(진천군청)가 제34회 전국실업단대항육상경기대회에 출전해 예선 8명 중 7위에 올랐다.김민지는 지난 7일부터 9일까지 서천 종합운동장 육상경기장에서 열린 제34회 전국실업단대항육상경기대회에 출사표를 던졌다. 김민지가 나선 종목은 100m와 400m 경기다. 그러나 이 날 김민지는 주종목이 아닌 100m 예선전에만 출전했다. 100m 종목 예선전은 총 3조로 나뉘어 치러졌다. 총 8명이 나서는 결승은 각 조 1, 2위와 더불어 차순위로 기록이 좋은 선수 두 명에게 출전권이 돌아간다. 김민지는 이 날 예선 1조에 속했다. 예선 1조에는 김다은, 김소은(이상 가평군청), 류지연(안동시청), 류나희(안산시청), 황윤경(시흥시청), 문시연(김포시청), 한경민(김포시청)에 김민지를 포함해 총 8명의 선수가 경기에 나섰다.이 중 김다은이 11.85의 기록으로 1위를 차지했으며 뒤를 이어 김소은이 12.05로 2위, 이민정이 12.03의 기록으로 3위에 올라 예선을 통과했다. 김민지는 12.80으로 8명 중 7위에 올라 예선에서 탈락했다.김다은은 결승에서 기록을 단축해 11.79의 기록으로 전체 1위를 차지했다. 김소은 역시 11.99로 전체 2위에 올랐다. 진천군청 김민지, 김민지 SNS 계정김민지는 주종목인 400m 예선 1조에도 이름을 올렸지만 기권을 선언하며 결국 100m 예선만 출전하고 경기를 마쳤다. 400m 예선 1조에는 김지은(전북개발공사), 김경화(포항시청), 이연우(인천남동구청), 민지현(가평군청), 임지희(시흥시청), 이해인(정선군청), 김민지(진천군청)가 포함돼있었으나 이 중 김지은, 김경화, 이연우를 제외한 나머지 네 명이 모두 기권했다. 이에 따라 3명 중 1위를 차지한 김지은이 57.58, 김경화가 58.77로 본선에 나섰다.소속팀인 진천군청 관계자는 김민지가 주종목이 아닌 단거리 100m만 출전한 것에 대해 ""선수 컨디션에 따라 출전 종목이 변경될 수 있다. 컨디션에 따라 종목을 바꿔나서기에 스케줄 확정을 지을수 없다""며 ""김민지는 향후 10월부터 열릴 제104회 전국체육대회에는 출전할 예정""이라고 전했다."
009;0005186125;송강영 교수, 국민체육진흥공단 한국스포츠정책과학원 원장 취임;조현재 국민체육진흥공단 이사장(왼쪽)과 송강영 신임 한국스포츠정책과학원 원장이 포즈를 취하고 있다. 국민체육진흥공단국민체육진흥공단 한국스포츠정책과학원 신임 원장에 송강영 동서대학교 교수가 13일 취임했다.송강영 신임 원장은 서울대학교 대학원에서 체육교육학 석사, 교육학 박사 학위를 취득한 후 2000년 동서대학교 교수로...;https://imgnews.pstatic.net/image/thumb154/009/2023/09/13/5186125.jpg;2023-09-13T15:54:07;조현재 국민체육진흥공단 이사장(왼쪽)과 송강영 신임 한국스포츠정책과학원 원장이 포즈를 취하고 있다.  국민체육진흥공단국민체육진흥공단 한국스포츠정책과학원 신임 원장에 송강영 동서대학교 교수가 13일 취임했다.송강영 신임 원장은 서울대학교 대학원에서 체육교육학 석사, 교육학 박사 학위를 취득한 후 2000년 동서대학교 교수로 부임했다. 이후 체육인재육성재단 이사장, 한국여가레크리에이션학회 회장, 한국체육학회 부회장, 한국융합과학회 회장 등을 역임했다. 체육 분야에 대한 깊은 지식과 다양한 경험을 바탕으로 국민체육진흥을 위한 체육정책 개발 및 스포츠 과학의 체계적 연구에 크게 기여할 적임자로 평가받고 있다.송강영 원장은 “대한민국 스포츠의 명실상부한 싱크탱크인 한국스포츠정책과학원의 신임 원장이 돼 어깨가 무겁다”면서 “교육자, 행정가로서 느낀 경험을 살려 체육진흥에 힘쓰겠다”고 취임 소감을 밝혔다. 송 원장의 임기는 2025년 9월 12일까지 2년이다.
396;0000655053;한국마사회, 스포츠말 품평회·어린말 승마대회 상주서 개최;어린말 승마대회 경기 장면. 사진=한국마사회 한국마사회는 말산업 육성 발전을 위한 ‘제12회 스포츠말 품평회’와 ‘제10회 어린말 승마대회’가 지난 12일 경북 상주에 위치한 상주국제승마장에서 막을 올렸다고 13일 밝혔다.    ‘스포츠말 품평회’는 승용마의 체계적인 품질평가를 통해 생산농가의 조련 성과를 검증하고 승용마...;https://imgnews.pstatic.net/image/thumb154/396/2023/09/13/655053.jpg;2023-09-13T15:53:01;한국마사회는 말산업 육성 발전을 위한 ‘제12회 스포츠말 품평회’와 ‘제10회 어린말 승마대회’가 지난 12일 경북 상주에 위치한 상주국제승마장에서 막을 올렸다고 13일 밝혔다.      ‘스포츠말 품평회’는 승용마의 체계적인 품질평가를 통해 생산농가의 조련 성과를 검증하고 승용마 거래 신뢰성을 강화하기 위해 15년 시작해 올해 12회를 맞았다.      한국마사회 또는 제주축산진흥원에 등록된 국산 승용마와 포니를 대상으로 열리는 이번 품평회에는 총 31두가 참가를 알렸다.      12일과 13일 양일간 2~3세 마령의 어린 말들은 실내마장에 마련된 대회장에서 체형과 보행, 프리점핑(기승자 없이 말 스스로 장애물을 비월)분야에 걸쳐 품질을 평가 받는다.      평가 결과에 따라 등급을 획득한 승용마 소유자에게 획득 등급별로 산정된 조련지원금이 주어진다. 대회의 각 부문별 우수한 성적을 거둔 말에게는 추가 인센티브의 기회까지 더해진다.      같은 기간 실외 경기장에서는 마령 4세 이상 7세 이하의 국산 어린 승용마들이 참가하는 ‘어린말 승마대회’가 열린다. 국내산 우수 승용마 조기 발굴과 유통 활성화를 위한 어린말 승마대회에는 총 65두의 국산 우수 승용마가 출전한다.      참가 말들은 참가 선수와 함께 마장마술, 장애물 등 총 8개 종목에 참가하며 총 175회의 경기가 펼쳐진다. 8개 종목별로 1위에서 5위의 우수한 성적을 거둔 승용마의 소유자에게는 조련지원금이 수여된다.      한국마사회는 스포츠말 품평회와 어린말 승마대회를 통해 승용마 거래 촉진에 나선다.      대회 기간 중 설치되는 거래부스에서 거래가 가능한 출전마들의 정보를 얻을 수 있으며 거래부스를 통해 구매계약을 체결하는 이들에겐 100만원 상당의 인센티브까지 주어진다.     김민지 기자 minji@sportsworldi.com
003;0012087936;"中 탁구 대표팀 감독 ""AG은 파리올림픽 위한 좋은 시험대""";[서울=뉴시스] 최진석 기자 = 10일 오전 강원도 평창군 평창돔체육관에서 열린 '2023 평창아시아탁구선수권대회-버터플라이' 여자복식 한국 전지희·신유빈과 중국 쑨잉샤·왕이디의 경기에서 쑨잉샤가 기뻐하고 있다. (사진=평창아시아탁구선수권대회 조직위 제공) 2023.09.10. photo@newsis.com *재판매 및...;https://imgnews.pstatic.net/image/thumb154/003/2023/09/13/12087936.jpg;2023-09-13T15:52:33;"""파리올림픽에서 中 선수 다양한 종목 출전""""아시안게임에서 종목 적응·체력 유지 시험""[서울=뉴시스] 최진석 기자 = 10일 오전 강원도 평창군 평창돔체육관에서 열린 '2023 평창아시아탁구선수권대회-버터플라이' 여자복식 한국 전지희·신유빈과 중국 쑨잉샤·왕이디의 경기에서 쑨잉샤가 기뻐하고 있다. (사진=평창아시아탁구선수권대회 조직위 제공) 2023.09.10. photo@newsis.com *재판매 및 DB 금지[서울=뉴시스] 이명동 기자 = 리쑨 중국 탁구대표팀 감독이 2022 항저우 아시안게임이 다음 해 열리는 파리올림픽 전 팀 기량을 평가할 좋은 시험대라고 봤다.11일 중국 관영 영자지 차이나데일리에 따르면 리 감독은 ""파리올림픽에서 중국 선수가 다양한 종목에 출전할 수도 있다""라며 ""아시안게임은 선수가 다른 종목에 적응하고 체력을 유지하는 방법에 관한 좋은 시험대가 될 것""이라고 전망했다.중국은 탁구 종목에서 강세를 보여왔다. 2018 자카르타·팔렘방 아시안게임에서 금메달 5개를 수확했다. 이번 대회는 파리올림픽을 앞두고 국제대회에서 기량을 점검할 수 있는 마지막 기회가 될 것으로 보인다.여자 단식에 출전하는 중국의 간판스타 쑨잉샤는 ""이제는 아시안게임 준비에 전력을 다해 대회에서 최고의 모습을 보여주고 싶다""고 포부를 밝혔다.45개국에서 1만2500여 명이 참가하는 이번 대회는 오는 23일부터 다음 달 8일까지 16일 동안 경합을 이어간다. 참가 선수는 40개 종목 61개 세부 종목에서 모두 483개의 금메달을 놓고 경쟁을 펼친다. 이번 대회에 중국 측은 900여 명이 넘는 선수가 참가 등록했다.한편 이번 대회는 1990 베이징 아시안게임, 2010 광저우 아시안게임에 이어 중국에서 열리는 세 번째 아시안게임이다."
