oid;aid;title;subContent;thumbnail;dateTime;content003;0012086797;"천위페이 ""AG 금메달 경쟁자는 안세영 아닌 나 자신""";[코펜하겐=신화/뉴시스] 천위페이(25·중국)가 지난달 26일 덴마크 코펜하겐에서 열린 2023 세계개인배드민턴선수권대회 여자 단식 준결승전에서 안세영(21)과 시합하고 있다. 2023.09.13.[서울=뉴시스] 이명동 기자 = 천위페이(25·중국)가 제19회 2022 항저우 아시안게임에서는 금메달에 도전한다. 그는 지난...;https://imgnews.pstatic.net/image/thumb154/003/2023/09/13/12086797.jpg;2023-09-13T11:24:26;"천위페이 ""대회 준비에 최선을 다하겠다""지난달 세계선수권서 안세영에 패해 3위도쿄서 올림픽 金·세계선수권 銀 경험해[코펜하겐=신화/뉴시스] 천위페이(25·중국)가 지난달 26일 덴마크 코펜하겐에서 열린 2023 세계개인배드민턴선수권대회 여자 단식 준결승전에서 안세영(21)과 시합하고 있다. 2023.09.13.[서울=뉴시스] 이명동 기자 = 천위페이(25·중국)가 제19회 2022 항저우 아시안게임에서는 금메달에 도전한다. 그는 지난달 2023 세계개인배드민턴선수권대회에서 세계 1위 안세영(21)에게 밀려 동메달에 그쳤다.11일 중국 관영 영자지 차이나데일리에 따르면 천위페이는 오는 23일 개막하는 항저우 아시안게임을 두고 ""대회 준비에 최선을 다하겠다""며 ""천위페이만이 천위페이를 이길 수 있다""고 말했다.이 같은 발언은 안세영을 의식한 것으로 풀이된다. 세계선수권 2위를 차지한 카롤리나 마린(30·스페인)은 아시안게임에 참가할 수 없기 때문이다.천위페이는 지난달 26일 덴마크 수도 코펜하겐 로얄 아레나에서 열린 세계선수권 여자 단식 준결승에서 안세영에게 0-2(19-21 15-21)로 패했다. 안세영과의 상대 전적은 10승6패가 됐다.[코펜하겐=AP/뉴시스] 안세영(1위)이 지난달 26일(현지시간) 덴마크 수도 코펜하겐의 로열 아레나에서 열린 2023 세계개인배드민턴선수권대회 여자 단식 준결승에서 '천적' 천위페이(3위·중국)와 경기하고 있다. 안세영이 2-0(21-19 21-15)으로 이기고 결승에 올라 한국 선수 사상 처음으로 세계선수권 대회를 우승했다. 2023.09.13.결승에 오른 안세영은 2016 리우데자네이루 올림픽 금메달리스트이자 세계선수권 3회 우승자인 마린를 꺾어 생애 첫 세계선수권 우승을 달성했다.세계 3위 천위페이는 국제대회에서 좋은 성적을 거둬왔다. 2020 도쿄올림픽 여자 단식에서 정상을 차지한 데 이어 2022 도쿄 세계선수권 여자 단식에서 은메달을 차지했다. 2019년 12월에는 세계 순위 1위에 오르기도 했다.다만 아시안게임에서 금메달을 맛보지는 못했다. 이번 대회 금메달이 절실한 이유다. 그는 아시안게임 메달과는 2018 자카르타·팔렘방 대회에서 여자 단체전 은메달을 따면서 유일한 인연을 맺었다."
001;0014189742;'오산시의회 vs 체육회' 갈등, '시의회 vs 시장' 갈등으로 번져;"시의회 ""체육회장 사퇴 전까지 정회""…시장 ""시의원 대우 않겠다""(오산=연합뉴스) 최해민 기자 = 경기 오산시의회가 시 체육회장의 '의회 공개 비난'을 놓고 본회의 무기한 정회를 선언한 데 대해 이권재 시장이 ""시의원 대우를 하지 않겠다""고 맞받아치면서 시의회와 체육회 간 갈등이 시의회와 시장 간 갈등으로 번지고 있다.임...";https://imgnews.pstatic.net/image/thumb154/001/2023/09/13/14189742.jpg;2023-09-13T11:23:08;"시의회 ""체육회장 사퇴 전까지 정회""…시장 ""시의원 대우 않겠다""(오산=연합뉴스) 최해민 기자 = 경기 오산시의회가 시 체육회장의 '의회 공개 비난'을 놓고 본회의 무기한 정회를 선언한 데 대해 이권재 시장이 ""시의원 대우를 하지 않겠다""고 맞받아치면서 시의회와 체육회 간 갈등이 시의회와 시장 간 갈등으로 번지고 있다.임시회 본회의 정회 선언하는 성길용 오산시의장[오산시의회 제공. 재판매 및 DB 금지]    성길용 시의장은 13일 오전 열린 임시회 3차 본회의에서 ""체육회장의 도를 넘은 행위에 대해 시의회는 이권재 시장의 재발 방지 약속과 체육회장 사퇴 시까지 본회의를 무기한 정회하겠다""고 말하고 정회를 선포했다.    이어 더불어민주당 시의원 5명이 모두 퇴장하자 이 시장은 본회의장에 남아 ""체육회와 시의회 간 감정으로 인해서 이번 회기를 마무리하지 않고 끝내는 것은 시의회로서 존재 가치가 없다""며 ""내일부터 모든 시의원을 시의원으로 대우하지 않겠다""고 발언했다.    정회한 본회의가 속개되지 않으면 회기 중 진행돼 온 38건의 조례안 심사 결과를 포함한 임시회 안건은 이날 자정을 기해 자동 폐기되며 다음 임시회가 열려야 다시 상정할 수 있다.    민주당 시의원들은 이 시장의 강경 발언과 관련해 대책을 논의 중이다.    앞서 지난 9일 권병규 오산시체육회장은 제35회 시민의날 체육대회 행사장에서 대회사 도중 ""체육회 예산을 삭감한 오산시의원들을 왜 내빈으로 소개하냐"", ""체육회 예산을 깎은 행위는 체육인을 무시하는 처사다"", ""시의원들은 선거철만 인사하고 다닌다""는 등의 발언을 했다.    권 회장이 언급한 '예산 삭감'은 의회가 이번 추경 예산안에 상정된 체육회 예산 3건 가운데 워크숍 행사 예산 1천100만원을 삭감한 것을 의미한다.    이에 시의회는 지난 11일 여야 의원 전원이 참여한 기자회견을 열고 권 회장의 사퇴를 촉구하는 기자회견을 열었다.권병규 오산시체육회장 기자회견[연합뉴스. 재판매 및 DB 금지]    권 회장은 이날 임시회 본회의가 열리기 30분 전인 오전 9시 30분 오산시청 1층 로비에서 반박 기자회견을 통해 ""정제되지 않은 발언에 대해 시민들에게 유감을 표시한다""면서도 시의회에 대해선 ""매년 시행한 행사 예산인데 깎았다. 의원들은 공부 좀 해야 한다. 무식한 사람들이다. 예산 삭감은 폭거다""며 ""사퇴는 제가 할 게 아니라 시의원들이 해야 한다""고 재차 비난했다.    성 시의장의 무기한 정회 선언은 이 같은 권 회장의 반박 기자회견 발언을 듣고 결정한 것으로 전해졌다.    goals@yna.co.kr"
108;0003181188;조코비치 없어도 '강호' 세르비아 벽 높았다, 한국 테니스 데이비스컵 1차전 패배;"[스타뉴스 | 이원희 기자] 경기에 집중하는 권순우. /사진=대한테니스협회 제공홍성찬. /사진=대한테니스협회 제공한국 남자 테니스 대표팀이 &#039;세계 랭킹 1위&#039; 노박 조코비치가 빠진 세르비아에 패했다.김영준 감독이 이끄는 한국 대표팀은 13일(한국시간) 스페인 발렌시아에서 열린 국가대항전 데이비스컵 파이널...";https://imgnews.pstatic.net/image/thumb154/108/2023/09/13/3181188.jpg;2023-09-13T11:23:04;"[스타뉴스 | 이원희 기자] 경기에 집중하는 권순우. /사진=대한테니스협회 제공홍성찬. /사진=대한테니스협회 제공한국 남자 테니스 대표팀이 '세계 랭킹 1위' 노박 조코비치가 빠진 세르비아에 패했다.김영준 감독이 이끄는 한국 대표팀은 13일(한국시간) 스페인 발렌시아에서 열린 국가대항전 데이비스컵 파이널스 C조 조별리그 1차전에서 세르비아에 0-3으로 졌다.이번 대회는 세계 16강이 출전한다. 4개 조로 나뉘어 조별리그를 치르고, 성적이 가장 좋은 각 조 2개국은 올해 11월 스페인 말라가에서 열리는 8강에 진출한다.사상 처음으로 2년 연속 데이비스컵 파이널스에 진출한 한국은 세르비아에 패해 쉽지 않은 출발을 알렸다.한국은 1, 2단식에 홍성찬(194위·세종시청), 권순우(112위·당진시청)가 출전했다. 복식에서는 남지성(복식 126위·세종시청)-송민규(복식 185위·KDB산업은행)가 호흡을 맞췄다.세르비아에서는 최근 US오픈에서 우승해 메이저 대회 최다 24회 우승 기록을 보유한 조코비치를 비롯해 라슬로 제레(37위), 두산 라요비치(52위), 니콜라 카치치(복식 62위), 미오미르 케츠마노비치(복식 184위) 등이 팀을 이뤘다. 이날 세르비아는 '에이스' 조코비치가 경기에 나서지 않았다.하지만 조코비치가 없어도 세르비아는 위력을 발휘했다. 한국이 넘기엔 쉽지 않은 벽이었다.한국은 오는 14일 체코와 조별리그 2차전에서 첫 승에 도전한다. 17일에는 스페인을 상대한다.복식 호흡을 맞춘 송민규와 남지성(오른쪽). /사진=대한테니스협회 제공2단식에 나서 제레와 맞붙은 한국 에이스 권순우는 경기 후 대한테니스협회를 통해 ""오랜만에 긴장감 있는 경기를 하다 보니까 첫세트 초반에 타이트하다고 느꼈다. 2세트에서는 긴장이 풀리다 보니 루즈해졌다. 3세트에서 경기력을 올려보려고 했지만 상대 선수가 워낙 잘 했고 경기력이 살아 났다. 경험이 많이 부족했던 것 같다""고 아쉬움을 드러냈다.현지에서 응원을 보낸 한국 팬들에게는 ""오랜만에 많은 관중들 앞에서 경기하다 보니 관중들 덕분에 힘낼 수 있었고 테니스의 재미를 또 한 번 느낀 것 같다""며 ""경기는 졌지만 오랜만에 이런 분위기 속에서 경기할 수 있어서 즐거웠다. 응원해 주신 팬들 덕분에 이렇게 경기할 수 있었던 것 같아 감사하다""고 고마워했다.권순우는 앞으로 한국 랭킹 1위로서 상대 에이스들과 붙어야 한다. 이에 대해 ""상대 에이스와 경기하는 데 크게 부담감이 없다. 오히려 나에게 좋은 기회이고 재미있는 경기를 할 수 있는 것 같다. 에이스끼리 붙는다는 자부심도 있고 꼭 이기고 싶은 마음도 있다. 즐거운 마음만 있다""고 답했다.김영준 감독은 ""큰 무대에서 긴장이 안 된다고 하면 거짓말이다. 그 긴장감을 즐기려고 했고 첫 경기가 가장 힘들지 않나 싶다. 비록 결과는 졌지만 내용 면에서는 나쁘지 않았고 좋았다고 생각한다. 이번 세르비아전이 체코, 스페인과 경기를 더 잘 할 수 있는 계기가 되지 않을까 생각한다""고 만족했다.다음 체코전에 대해선 ""결코 만만한 상대가 아니다. 하지만 이번 경기처럼 한 팀이 된다면 충분히 이길 기회가 있을 것이라 생각한다""고 승리 의지를 불태웠다.김영준 감독. /사진=대한테니스협회 제공"
109;0004926051;대한체육회 평창동계훈련센터 LED 전광판 기증식 개최;"[OSEN=우충원 기자] 대한체육회는 12일 오후 평창동계훈련센터에서 대한바이애슬론연맹(회장 이혁렬)과 함께 LED 전광판 기증식을 개최했다.이날 기증식은 이혁렬 대한바이애슬론연맹 회장이 옥외형 LED 전광판(4.2m&times;1.2m)을 기증함에 따라 열리게 되었으며, 이종성 평창동계훈련센터장, 이혁렬 대한바이애슬론연...";https://imgnews.pstatic.net/image/thumb154/109/2023/09/13/4926051.jpg;2023-09-13T11:22:10;[OSEN=우충원 기자] 대한체육회는 12일 오후 평창동계훈련센터에서 대한바이애슬론연맹(회장 이혁렬)과 함께 LED 전광판 기증식을 개최했다.이날 기증식은 이혁렬 대한바이애슬론연맹 회장이 옥외형 LED 전광판(4.2m×1.2m)을 기증함에 따라 열리게 되었으며, 이종성 평창동계훈련센터장, 이혁렬 대한바이애슬론연맹 회장을 비롯한 관계자들이 자리한 가운데 환영인사, 기증식, 사진촬영 순으로 진행되었다.대한바이애슬론연맹은 평창동계훈련센터가 지난 4월 26일 개관함에 따라 동계스포츠 발전을 기원하며 1,600만 원 상당의 옥외형 LED 전광판을 기증하였으며, 전광판은 평창동계훈련센터 정문에 설치하여 센터 정보 제공, 환영사 게시 등에 활용할 계획이다.이종성 센터장은 “동계스포츠 발전 및 평창동계훈련센터 운영을 위해 전광판을 기증해주신 대한바이애슬론연맹에 감사하다”며, “선수들이 최상의 컨디션으로 훈련할 수 있도록 센터에서도 다방면으로 노력하겠다”고 전했다.이에 이혁렬 대한바이애슬론연맹 회장은 “평창동계훈련센터 운영 및 동계종목 선수들이 훈련하는 데 실질적인 도움이 되길 바란다”고 말했다. / 10bird@osen.co.kr[사진] 대한체육회 제공.
021;0002593843;강원동계청소년올림픽, 마스코트 앞세워 전주서 게릴라 홍보;2024 강원동계청소년올림픽 마스코트 뭉초가 전주 한옥마을에서 대회 홍보를 하고 있다. 2018평창기념재단 2024 강원동계청소년올림픽이 마스코트 뭉초를 앞세워 전라북도 전주에서 게릴라 홍보를 진행했다.13일 2018평창기념재단에 따르면 강원동계청소년올림픽 뭉초는 지난 7∼8일 제14회 한·중·일 문화 장관 회의가 개최된...;https://imgnews.pstatic.net/image/thumb154/021/2023/09/13/2593843.jpg;2023-09-13T11:22:05;2024 강원동계청소년올림픽 마스코트 뭉초가 전주 한옥마을에서 대회 홍보를 하고 있다. 2018평창기념재단  2024 강원동계청소년올림픽이 마스코트 뭉초를 앞세워 전라북도 전주에서 게릴라 홍보를 진행했다.13일 2018평창기념재단에 따르면 강원동계청소년올림픽 뭉초는 지난 7∼8일 제14회 한·중·일 문화 장관 회의가 개최된 전주에서 게릴라 홍보를 진행했다. 뭉초는 아시아 문화계의 눈길이 쏠린 전주를 방문, 관광객과 시민들을 대상으로 강원동계청소년올림픽을 알렸다.뭉초는 공모전을 통해 선발된 강원동계청소년올림픽 마스코트다. 2018 평창동계올림픽의 마스코트였던 수호랑과 반다비가 가지고 놀던 눈뭉치가 강원동계청소년올림픽을 앞두고 새롭게 태어났다는 스토리를 담고 있다. 뭉초는 강원동계청소년올림픽을 준비하는 선수들처럼 고글과 목도리를 착용하고 있다.강원동계청소년올림픽는 내년 1월 19일 개막해 2월 1일까지 14일간 강원도에서 진행한다. 아시아에서 최초로 열리는 동계청소년올림픽으로 빙상 스케이팅과 아이스하키, 컬링 등 7개 경기 15개 종목으로 구성됐다. 강원동계청소년올림픽은 ‘Shine Together(함께 빛나자)!’를 캐치프레이즈로 정하고, 스포츠스타, 문화·예술계 인사들로 구성된 홍보대사들과 대회를 알리는 데 힘쓰고 있다.
057;0001768213;비즈니스 리더들의 선택, 매경골프 13기 이달 22일 개강;매경골프가 오는 22일부터 매경골프 13기를 모집합니다.지난 7월까지 12기 기수가 진행된 매경골프 13기 과정은 오는 22일부터 12월 8일까지 12주 동안 매주 금요일 남서울CC와 엘리시안강촌CC 등에서 필드레슨과 집중훈련 레슨이 진행될 예정입니다.또한, 매경미디어그룹의 네트워크를 활용해 참가자들에게 비즈니스 네트워크...;https://imgnews.pstatic.net/image/thumb154/057/2023/09/13/1768213.jpg;2023-09-13T11:21:51;골프 실력과 인맥 동시에 레벨업매경골프가 오는 22일부터 매경골프 13기를 모집합니다.지난 7월까지 12기 기수가 진행된 매경골프 13기 과정은 오는 22일부터 12월 8일까지 12주 동안 매주 금요일 남서울CC와 엘리시안강촌CC 등에서 필드레슨과 집중훈련 레슨이 진행될 예정입니다.또한, 매경미디어그룹의 네트워크를 활용해 참가자들에게 비즈니스 네트워크 확장의 기회를 제공할 예정입니다.여기에 KPGA, KLPGA 선수출신 프로 강사진의 지도 아래 골프 스킬 강화뿐만 아니라, 실제로 겪는 트러블 상황에 대한 해결 방안을 함께 상의하고 지도받을 수 있게 됩니다.이번 매경골프 13기는 책임교수 조도현 프로를 비롯하여 박상언 프로, 주서율 프로, 조하빈 프로 등의 지도교수가 프로 강사진으로 나설 예정입니다.본 과정에 신청을 희망하는 사람은 인터넷 검색창을 통해 ‘매경레벨업골프멤버십’의 홈페이지에서 자세히 보실수 있습니다.[김종만 인턴]
109;0004926043;첫 해외 파견 태권도 교관!‘주월한국군 태권도 교관단’ 활동 보고서 발간;"[OSEN=우충원 기자] 태권도진흥재단(이사장 직무대행 이종갑) 국립태권도박물관은 1960년대부터 70년대 월남전 당시 한국군 태권도 교관단의 파병과 활동을 정리하고 관련 자료를 문화재로 등록하기 위해 &lsquo;주월한국군 태권도 교관단의 활동과 기증자료 분석 보고서&rsquo;를 발간했다.보고서에는 월남전 당시 파병된...";https://imgnews.pstatic.net/image/thumb154/109/2023/09/13/4926043.jpg;2023-09-13T11:14:08;[OSEN=우충원 기자] 태권도진흥재단(이사장 직무대행 이종갑) 국립태권도박물관은 1960년대부터 70년대 월남전 당시 한국군 태권도 교관단의 파병과 활동을 정리하고 관련 자료를 문화재로 등록하기 위해 ‘주월한국군 태권도 교관단의 활동과 기증자료 분석 보고서’를 발간했다.보고서에는 월남전 당시 파병된 600여 명 태권도 교관단의 1964년부터 1973년까지 10여 년간의 활동을 담고 있다. 태권도 교관단은 현지에서 23만여 명에게 태권도를 지도해 2,916명의 유단자 배출했으며 351회의 태권도 시범으로 태권도를 알리는 첨병으로서 한국과 한국군에 대한 호감도를 높이고 한국군 작전에도 다양한 긍정적 효과를 가져왔다.태권도진흥재단이 이번 보고서에 대해 각별한 애정을 쏟고 있는 이유는 태권도 해외 진출사에서 주월 한국군 태권도 교관단이 그 출발선에 있기 때문이다. 국가 차원에서 태권도 교관이 장기간 파견되어 주둔국의 군인과 국민을 대상으로 태권도 교육과 시범을 보인 것은 주월 태권도 교관단이 처음이자 유일했기 때문이다. 또한 대한민국 정부 수립 이후 한국군의 첫 해외 파병이면서 가장 먼저 파병된 부대가 태권도 교관단이었다는 점에서 큰 평가를 받고 있다. 특히, 군사원조의 일환으로 태권도 교육 보급이 군인과 민간인에게까지 확대되어 태권도 가치 보존에 큰 역사적 의미를 지니고 있다.이번 보고서는 월남전 태권도 교관단에 관한 연구에 있어 자료 부족 등을 극복하고 발간되었다는 특이점을 갖는다. 지난 3월 주월 한국군 교관단에서 국립태권도박물관으로 당시 문서, 기념패, 메달, 훈장, 사진 등 227점의 자료를 기증해 옴에 따라 주월 한국군 태권도 교관단 활동에 대한 실증적 유물로 보고서 발간이 이루어졌다.태권도진흥재단은 이번 분석 보고서 발간을 시작으로 내년 상반기 국립태권도박물관에서‘주월한국군 태권도 교관단 기증전(가칭)’ 개최를 추진해 그 가치를 국민들에게 홍보할 계획이다.태권도진흥재단 이종갑 이사장 직무대행은 “태권도 해외 진출에 있어 첫 발자취라고 할 수 있는 주월 태권도 교관단의 사진과 동영상 자료는 매우 희귀성을 지니고 있다”라며 “태권도 가치를 보존하고 이어가는 것이 우리 재단의 역할로 앞으로도 최선의 노력을 다 하겠다”라고 말했다.한편, 태권도진흥재단은 ‘주월한국군 태권도교관단의 활동과 기증자료 분석보고서’를 국립태권도박물관 누리집과 태권도라키비움 사이트에 공개하고 태권도 단체와 군 관련 기관 등에 전달할 예정으로 관련 연구를 이어갈 계획이다. / 10bird@osen.co.kr[사진] 재단 제공.
001;0014189625;40년 동안 '2명뿐'…올림픽·AG 모두 개회식 기수 맡는 구본길;"2010년 AG·2012년 올림픽 윤경신 이은 진기록…""영광스럽고 감사""&lt;올림픽&gt; 대한민국 선수단 입장(리우데자네이루=연합뉴스) 임헌정 기자 = 5일(현지시간) 브라질 리우데자네이루 마라카낭 주경기장에서 열린 2016리우올림픽 개막식에서 기수 구본길(펜싱)을 선두로 대한민국 선수단이 입장하고 있다. 2016.8...";https://imgnews.pstatic.net/image/thumb154/001/2023/09/13/14189625.jpg;2023-09-13T11:10:09;"2010년 AG·2012년 올림픽 윤경신 이은 진기록…""영광스럽고 감사""<올림픽> 대한민국 선수단 입장(리우데자네이루=연합뉴스) 임헌정 기자 = 5일(현지시간) 브라질 리우데자네이루 마라카낭 주경기장에서 열린 2016리우올림픽 개막식에서 기수 구본길(펜싱)을 선두로 대한민국 선수단이 입장하고 있다. 2016.8.6 kane@yna.co.kr(서울=연합뉴스) 최송아 기자 = 이달 23일 개막하는 항저우 아시안게임에서 한국 선수 역대 최다 금메달에 도전하는 남자 펜싱의 간판 구본길(34·국민체육진흥공단)이 대회를 본격적으로 시작하기도 전에 특별한 기록의 주인공이 됐다.    구본길은 오는 23일 중국 항저우 올림픽 스포츠 센터 스타디움에서 열리는 2022 항저우 아시안게임 개회식에 나설 대한민국 선수단의 기수로 수영의 김서영(경북도청)과 함께 낙점됐다.    특히 구본길은 2016 리우데자네이루 올림픽 때도 개막식 기수를 맡은 바 있어서 아시안게임과 올림픽 모두 대한민국의 '얼굴'로 나서는 영예를 누리게 됐다.    4년에 한 번 열려 선수들에게는 출전조차 '꿈'으로 여겨지는 올림픽과 아시안게임에서 모두 개회식 선수단 기수가 되는 건 더 흔치 않은 일이다.    관련 기록이 확인되는 1982년 뉴델리 아시안게임을 시작으로 지난 40여년 간 하계 올림픽과 아시안게임의 대한민국 선수단 기수 명단을 보면, 두 대회 모두 기수를 맡아본 인물은 핸드볼의 전설 윤경신(50) 현 두산 감독뿐이다. 구본길이 두 번째 사례가 된다.<올림픽>위풍당당 대한민국(런던=연합뉴스) 서명곤 기자 = 지구촌 최대 스포츠축제가 될 제30회 런던하계올림픽이 28일 영국 런던 북동부 리밸리의 올림픽스타디움에서 화려한 막을 올렸다. 개막식에서 태극기를 든 핸드볼 대표팀 윤경신 선수를 선두로 대한민국 선수단이 입장하고 있다.   2012.7.28 seephoto@yna.co.kr선수로 아시안게임에서 금메달 5개를 목에 걸었고, 2012년 런던 대회까지 올림픽에 5차례 출전했던 윤 감독은 2010년 광저우 아시안게임과 2년 뒤 런던 올림픽 개회식에서 모두 태극기를 들고 앞장선 바 있다.    구본길의 이력도 윤 감독 못지않게 화려하다.    2010년 광저우 대회부터 지난 세 차례 아시안게임에서 펜싱 남자 사브르 개인전 3연패를 이루고 단체전에선 2개(2014 인천, 2018 자카르타·팔렘방)의 금메달을 따냈다.    항저우에서는 아시안게임 개인전 4연패와 3개 대회 연속 '2관왕'을 노린다.    이번 대회에서 개인전과 단체전을 석권한다면 그는 통산 7개의 금메달을 획득, 펜싱 선배 남현희(은퇴) 등이 보유한 6개를 앞질러 한국 선수 하계 아시안게임 최다 금메달 신기록을 세운다.    대표팀에서 오래 활약하며 성과를 내왔고, 이번 대회에서 상징적인 기록을 남길 수 있다는 점 등이 기수 선정에도 고려된 것으로 보인다.취재진 앞 구본길(진천=연합뉴스) 박동주 기자 = 24일 진천국가대표선수촌에서 열린 항저우 아시안게임 D-30 미디어데이.    펜싱 국가대표팀 구본길이 취재진을 향해 포즈를 취하고 있다. 2023.8.24 pdj6635@yna.co.kr구본길은 런던 올림픽과 2020 도쿄 올림픽에서 한국의 남자 사브르 단체전 금메달에 힘을 보탠 올림픽 금메달리스트이기도 하다.    구본길은 ""스포츠 선수에겐 올림픽이나 아시안게임이 가장 중요한 대회인데, 나라를 대표해 나가는 대회에서 기수를 맡는 건 개인적으로 큰 영광""이라며 ""제게 그런 기회를 주셔서 감사하고, 특히 이번에 '레전드' 윤경신 감독님과 같은 기록을 갖게 된 것도 기쁘다""고 소감을 밝혔다.    ""리우 올림픽 때는 부담감이 크기도 했지만, '가문의 영광'이라는 생각에 감사하고 뜻깊었다""고 떠올린 그는 ""올림픽 기수를 경험한 뒤 이번에 하게 됐으니 역할을 충실히 하고, 가장 중요한 경기 성적도 잘 내겠다""고 강조했다. 1980년대 이후 하계 올림픽 및 아시안게임 대한민국 선수단 개회식 기수    songa@yna.co.kr"
