oid;aid;title;subContent;thumbnail;dateTime;content654;0000052120;양양군 사이클 선수단 전국사이클대회 종합우승;▲ 양양군 사이클 선수단이 제22회 인천광역시장배 전국사이클대회에서 남자일반부 종합우승을 차지했다.양양군 사이클 선수단이 전국사이클대회에서 종합우승을 차지했다.군청 사이클팀은 이달 9일부터 13일까지 인천광역시 인천국제벨로드롬에서 열린 제22회 인천광역시장배 전국사이클대회에 출전해 남자일반부 종합우승을 거두는 쾌거를 올렸...;https://imgnews.pstatic.net/image/thumb154/654/2023/09/14/52120.jpg;2023-09-14T13:07:03;▲ 양양군 사이클 선수단이 제22회 인천광역시장배 전국사이클대회에서 남자일반부 종합우승을 차지했다.양양군 사이클 선수단이 전국사이클대회에서 종합우승을 차지했다.군청 사이클팀은 이달 9일부터 13일까지 인천광역시 인천국제벨로드롬에서 열린 제22회 인천광역시장배 전국사이클대회에 출전해 남자일반부 종합우승을 거두는 쾌거를 올렸다고 밝혔다.이번 대회에서 선수단은 단체추발(김종우, 박한성, 이성연, 이시훈)과 함께 김청수 선수가 스프린트와 경륜에서 우승하는 등 금메달 3개, 은메달 3개, 동메달 1개를 획득하며 종합점수 114점으로 의정부시청(103점)과 국군체육부대(90점)을 제치고 우승트로피를 들어올렸다.이호식 감독은 종합우승과 함께 최우수감독상을 수상하는 영예를 안았다.한편 18세 이하 남자고등부에서는 양양고가 단체추발 1위(김종석, 정마루, 임종원, 장준우), 메디슨 2위(김종석, 임종원), 개인추발 3위(김종석)의 성적으로 금1, 은1, 동1를 획득했다.
410;0000958335;스포츠토토코리아, 도박 문제 인식 주간 맞아 온오프라인 활동;온라인 홍보 강화 및 건전화 캠페인 활동 전개꾸준한 도박중독 예방, 과몰입 방지 현장 캠페인국민체육진흥공단 체육진흥투표권 스포츠토토 수탁사업자 스포츠토토코리아가 ‘도박 문제 인식 주간’을 맞아 ‘베트맨’을 통한 온라인 홍보를 강화하고, 전라남도 여수해양공원에서 건전화 캠페인을 전개했다.9월 11~17일은 사행산업통합감독위...;https://imgnews.pstatic.net/image/thumb154/410/2023/09/14/958335.jpg;2023-09-14T13:06:01;온라인 홍보 강화 및 건전화 캠페인 활동 전개꾸준한 도박중독 예방, 과몰입 방지 현장 캠페인국민체육진흥공단 체육진흥투표권 스포츠토토 수탁사업자 스포츠토토코리아가 ‘도박 문제 인식 주간’을 맞아 ‘베트맨’을 통한 온라인 홍보를 강화하고, 전라남도 여수해양공원에서 건전화 캠페인을 전개했다.9월 11~17일은 사행산업통합감독위원회와 한국도박문제예방치유원이 지정한 ‘도박 문제 인식 주간’이다. 사회적인 문제로 대두되고 있는 도박 문제의 심각성을 알리는 한편, 도박중독 예방 및 치유를 위해 특별히 지정된 기간이다.스포츠토토코리아는 국내 사행산업자로서의 책임감을 느끼고, 고객들과 일반 시민들을 상대로 온오프라인에서 다양한 활동을 전개하는 데 집중하고 있다.공식 인터넷 발매 사이트 ‘베트맨’에 관련 팝업을 띄우고, 주 2회 발행되는 스포츠토토 경기정보지 ‘토토가이드’에도 포스터를 게재하는 등 적극적인 온라인 홍보를 펼쳤다.오프라인 캠페인 역시 강화됐다. 스포츠토토코리아는 9월 8~9일 전라남도 여수해양공원 일대에서 광주전남도박문제예방치유센터, 여수시중독관리통합지원센터, 전남스마트쉼센터, 소상공인시장진흥공단, 광주호남지역본부, 백년가게 및 백년소공인 등과 함께 도박중독 예방 캠페인을 펼쳤다.스포츠토토코리아 관계자는 현장을 방문한 여수 시민들을 대상으로 소액으로 건전하게 투표권을 구매하겠다는 내용의 서약서를 받고, 스포츠토토 관련 공익 영상을 소개하는 등 적극적인 계도 활동을 진행했다.이와 관련해 스포츠토토코리아 관계자는 “나날이 급증하는 도박중독에 대한 사회적 심각성에 공감하며, 도박문제 인식 주간을 맞아 적극적인 활동을 펼치기 위해 최선을 다하고 있다. 올해 연말까지 전국 각 지역에서 펼치는 도박중독 예방 캠페인에도 많은 관심과 참여를 부탁한다”고 전했다.
011;0004238345;장애인과 비장애인 함께 달린다…슈퍼블루마라톤;지난해 슈퍼블루마라톤 참가자들이 힘차게 출발하고 있다. 사진 제공=스페셜올림픽코리아션샤인 러닝클래서에서 훈련을 마친 가수 션과 참가자들이 기념 사진 촬영을 하고 있다. 사진 제공=스페셜올림픽코리아[서울경제] 대한민국 대표 장애 인식 개선 마라톤인 ‘2023 슈퍼블루마라톤’이 ‘우리가 함께 빛나는 순간’이라는 슬로건 아래...;https://imgnews.pstatic.net/image/thumb154/011/2023/09/14/4238345.jpg;2023-09-14T12:48:01;17일 서울 상암 평화의 공원서 개최지난해 슈퍼블루마라톤 참가자들이 힘차게 출발하고 있다. 사진 제공=스페셜올림픽코리아션샤인 러닝클래서에서 훈련을 마친 가수 션과 참가자들이 기념 사진 촬영을 하고 있다. 사진 제공=스페셜올림픽코리아[서울경제] 대한민국 대표 장애 인식 개선 마라톤인 ‘2023 슈퍼블루마라톤’이 ‘우리가 함께 빛나는 순간’이라는 슬로건 아래 오는 17일 오전 8시 서울 마포구 상암동 평화의 공원 평화광장에서 개최된다.스페셜올림픽코리아와 롯데가 공동 주최하는 슈퍼블루마라톤은 하프, 10㎞, 5㎞, 슈퍼블루 5㎞(장애인 코스) 부문으로 나뉘며 장애인 참가자 1500여 명을 포함해 총 8000명이 함께 달린다. 참가자들은 파란색 신발 끈을 묶고 출발선에서 장애인을 대하는 표현을 개선하는 ‘슈퍼블루 다섯 가지 약속’을 함께 외치며 장애에 대한 잘못된 인식의 벽을 허물게 된다.마라톤 사전 행사로 가수 션과 발달장애 작가 강선아가 함께 장애인들을 위한 ‘션샤인 러닝클래스’를 총 6회 진행해 50여 명의 참가자들이 달리기에 대한 체계적인 훈련을 받았다. 이번 러닝클래스에 참여한 발달장애인과 비장애인 참가자 전원은 대회 당일 모여 그동안 훈련한 달리기 실력을 뽐낼 예정이다. 강선아 작가는 이번 마라톤의 메달, 무대, 포스터, 기념품 등을 직접 디자인했으며 참가자들은 대회장 곳곳에서 발달장애인 작가의 재능을 살펴볼 수 있다.마라톤 완주 후 시작되는 2부 행사에는 시상식과 함께 가수 ‘코요태’의 축하 공연과 장애인 공연 팀 ‘아리아난타’의 시원한 난타 공연까지 눈과 귀가 즐거운 무대가 펼쳐질 예정이며 게임을 통해 다양한 경품을 증정하는 이벤트도 열린다.현장에는 의료부스 외에도 스포츠 테이핑 및 스포츠 마사지 부스의 운영을 통해 참가자들의 건강 및 안전 관리에 만전을 기할 예정이며 핀 버튼 만들기, 삐에로 풍선, 타투 스티커 및 페이스 페인팅 등 남녀노소 즐길 수 있는 체험 부스가 준비되어 있다.공동 주최사인 롯데 그룹의 계열사에서는 올해도 다양한 부스를 운영해 참가자들에게 재미와 편익을 제공하고, 특히 이번 대회에는 롯데월드 마스코트 ‘로티’와 ‘로리’가 깜짝 등장해 참가자들에게 즐거움을 선사할 예정이다.마라토너들 사이에 소문이 난 혜자 마라톤인 슈퍼블루마라톤은 참가자 전원에게 코오롱 티셔츠, 에코백, 기록증, 완주메달, 스티커팩, 스포츠테이핑, 음료, 간식, 기록증 등을 풍성하게 제공한다.이용훈 스페셜올림픽코리아 회장은 “장애인에 대한 작은 관심과 실천으로 2023 슈퍼블루마라톤에서 서로 따뜻한 마음을 주고받으며 파란 가을 하늘의 아름다운 추억과 희망을 만들기 바란다”며 “슈퍼블루마라톤 대회가 장애인들이 차별받지 않는 통합사회를 만들어나가고 선한 영향력을 널리 전파하는 기점이 되기 위해 더욱 노력하겠다”고 말했다.한편 2023 슈퍼블루마라톤은 문화체육관광부와 국민체육진흥공단이 후원하며 사회복지공동모금회가 지원한다.
425;0000143837;원종범, 세계역도선수권 남자 96㎏급에서 메달 3개 획득 '합계 2위';바를 드는 원종범 [국제역도연맹 홈페이지 캡처] 원종범이 세계역도선수권대회에서 메달 3개를 수확했다.13일(현지시간) 사우디아라비아 리야드에서 열린 2023 세계역도선수권 남자 96㎏급 경기에서 원종범은 인상 172㎏, 용상 212㎏, 합계 384㎏을 들었다.원종범은 인상 3위, 용상 2위와 더불어 합계에서도 2위를 기록...;https://imgnews.pstatic.net/image/thumb154/425/2023/09/14/143837.jpg;2023-09-14T12:06:01;"바를 드는 원종범 [국제역도연맹 홈페이지 캡처] 원종범이 세계역도선수권대회에서 메달 3개를 수확했다.13일(현지시간) 사우디아라비아 리야드에서 열린 2023 세계역도선수권 남자 96㎏급 경기에서 원종범은 인상 172㎏, 용상 212㎏, 합계 384㎏을 들었다.원종범은 인상 3위, 용상 2위와 더불어 합계에서도 2위를 기록해 은메달 두개와 동메달 한개를 목에 걸었다.이번 대회 한국이 따낸 첫 합계 은메달로 첫 메달은 여자 64㎏급에 출전한 박민경의 동메달이다.29명이 출전한 남자 96㎏급에서 카림 아보카흘라(26·이집트)는 인상 174㎏, 용상 213㎏, 합계 387㎏을 들며 금메달 두개와 은메달 한개를 획득하며 우승했다.국제역도연맹은 ""이라크가 올림픽 정식 종목인 스포츠의 세계선수권에서 금메달을 따낸 건, 이번 세계역도선수권 알-라미가 최초""라고 전했다.지난해 세계선수권에서 102㎏급에 출전해 11위에 머물렀던 원종범은 올해 체급을 바꿔 좋은 성적을 내고 있다. 원종범은 항저우 아시안게임에서도 남자 96㎏급에 출전해 메달 수확에 나선다."
425;0000143836;강원특별자치도민 생활체육대회, 내일 양구서 개막;제31회 강원특별자치도민 생활체육대회 엠블럼 [양구군 제공] 제31회 강원특별자치도민생활체육대회가 15일부터 17일까지 사흘간 강원도 양구군에서 열린다.'뛰어라 청춘양구, 피어라 강원체육'을 슬로건 아래 도내 18개 시군 선수와 임원, 관객 등 1만여명이 참가하며 선수들은 육상·수영·축구·야구·테니스·농구·탁구 등 22개...;https://imgnews.pstatic.net/image/thumb154/425/2023/09/14/143836.jpg;2023-09-14T12:00:01;"제31회 강원특별자치도민 생활체육대회 엠블럼 [양구군 제공] 제31회 강원특별자치도민생활체육대회가 15일부터 17일까지 사흘간 강원도 양구군에서 열린다.'뛰어라 청춘양구, 피어라 강원체육'을 슬로건 아래 도내 18개 시군 선수와 임원, 관객 등 1만여명이 참가하며 선수들은 육상·수영·축구·야구·테니스·농구·탁구 등 22개의 정식종목과 태권도·그라운드골프·파크골프 등 3개의 시범종목, 전시 종목인 드론 등 총 26개 종목에서 열띤 경쟁을 벌일 예정이다.15일 오후 5시 양구종합운동장에서 개회식을 시작으로 사전 공연과 각 시군 선수단 입장, 개회 선언, 환영사 및 축사, 축하공연에 이어 드론 라이트 쇼가 이어진다.양구군은 대회 기간 종합운동장 일원에 양구 농특산물 홍보, VR 체험 등을 함께 운영할 예정이다.서흥원 군수는 ""화합하는 축제의 장으로 조성하고자 민관군이 힘을 모아 준비했다""며 ""모두가 불편함 없이 안전하게 대회를 즐길 수 있도록 운영·관리에 힘쓰겠다""고 말했다."
057;0001768483;국민체육진흥공단, 서울올림픽 35주년 기념주간 운영;서울올림픽 35주년 기념행사 포스터 사진 = 국민체육진흥공 국민체육진흥공단이 서울올림픽 개최 35주년을 기념해 오는 17일부터 24일까지 ‘서울올림픽 개최 35주년 기념주간'을 운영합니다. 서울올림픽 기념주간은 역사상 가장 성공적인 올림픽대회로 손꼽히는 88 서울올림픽의 성과를 살펴보고 미래 세대에게 올림픽 가치를 전달하...;https://imgnews.pstatic.net/image/thumb154/057/2023/09/14/1768483.jpg;2023-09-14T11:57:38;"서울올림픽 35주년 기념행사 포스터 사진 = 국민체육진흥공 국민체육진흥공단이 서울올림픽 개최 35주년을 기념해 오는 17일부터 24일까지 ‘서울올림픽 개최 35주년 기념주간'을 운영합니다. 서울올림픽 기념주간은 역사상 가장 성공적인 올림픽대회로 손꼽히는 88 서울올림픽의 성과를 살펴보고 미래 세대에게 올림픽 가치를 전달하기 위해 기획됐습니다.오는 17일 스포츠문화 행사 '88하게 그린 페스티벌'을 시작으로, 18일 '서울올림픽 개최 35주년 기념식', 18일부터 22일까지 여의도 국회에서 '서울올림픽 개최 35주년 특별전'이 개최됩니다. 주말인 23일에는 1박 2일의 일정으로 청소년 캠프 '올림픽 라이크 가치교육'도 진행됩니다.조현재 공단 이사장은 ""대한민국 역사의 한 페이지를 장식한 서울올림픽을 기념하고 올림픽 유산을 바탕으로 스포츠로 더 나은 세상을 만드는 것은 공단의 중요한 역할""이라며 ""올림픽의 가치를 전파하는 다양한 프로그램을 준비한 만큼, 많은 참여 부탁드린다""고 말했습니다."
425;0000143835;中, 코로나19 이후 4년간 중단됐던 골프·테니스 투어 대회 재개;항저우 아시안게임 결단식에 참석한 중국 선수단 [신화=연합뉴스] 최근 4년 가까이 중단됐던 중국 내 골프와 테니스 투어 대회 개최가 재개된다.여자프로테니스(WTA) 투어는 18일부터 갤럭시 홀딩그룹 광저우오픈(총상금 25만9천 달러)을 중국 광둥성 광저우에서 개최한다.WTA 투어 대회가 중국 본토에서 열리는 것은 2020...;https://imgnews.pstatic.net/image/thumb154/425/2023/09/14/143835.jpg;2023-09-14T11:56:01;"항저우 아시안게임 결단식에 참석한 중국 선수단 [신화=연합뉴스] 최근 4년 가까이 중단됐던 중국 내 골프와 테니스 투어 대회 개최가 재개된다.여자프로테니스(WTA) 투어는 18일부터 갤럭시 홀딩그룹 광저우오픈(총상금 25만9천 달러)을 중국 광둥성 광저우에서 개최한다.WTA 투어 대회가 중국 본토에서 열리는 것은 2020년 1월 선전오픈 이후 이번 대회가 3년 8개월 만이다.중국에서는 이 대회를 시작으로 닝보오픈, 차이나오픈, 정저우오픈, 홍콩오픈, 장시오픈, 엘리트 트로피가 11월 초까지 이어진다.중국 내 WTA 투어는 2020년 상반기 신종 코로나바이러스 감염증(코로나19) 때문에 열리지 않기 시작했고, 2021년 말부터는 중국 선수인 펑솨이 문제로 인해 중국의 대회 개최가 금지됐다.2021년 11월 펑솨이가 중국 장가오리 전 부총리로부터 성폭행당했다고 주장한 이후 그의 안전을 걱정하는 여론이 전 세계적으로 일었고, WTA는 펑솨이와 관련된 의혹이 해소될 때까지 중국 내 투어 대회 개최를 보류한다고 선언한 바 있다.그러나 올해 4월 WTA가 중국 내 투어 대회 개최를 재개한다고 밝혔고, 그 첫 대회가 다음 주 광저우오픈이다.남자프로테니스(ATP) 투어 역시 다음 주 청두오픈, 주하이 챔피언십 등이 중국에서 열린다.중국 내 ATP 투어 대회는 2019년 10월 상하이 마스터스 이후 이번이 약 4년 만이다.골프의 글로벌 투어 대회들도 중국에서 오랜만에 다시 열린다.미국여자프로골프(LPGA) 투어 뷰익 상하이(총상금 210만 달러)가 10월 12일부터 나흘간 중국 상하이에서 개최된다.LPGA 투어의 중국 개최는 2019년 이 대회 이후 이번이 4년 만이다. LPGA 투어 관계자는 ""올해 상하이 대회는 정상적으로 개최를 준비 중""이라고 밝혔다.11월 초에는 중국 선전에서 아시안투어 대회인 볼보 차이나오픈(총상금 150만 달러)이 열리고, 이 대회는 2024년 5월에는 DP 월드투어 대회로 개최된다.볼보 차이나오픈은 2019년 유럽투어와 아시안투어 공동 개최로 열렸고 2020년과 2021년에는 중국 국내 대회로 축소됐으며 2022년에는 열리지 않았다.중국은 코로나19의 세계적인 유행 이후 2022년 2월 동계올림픽 이외에는 국제 대회를 거의 열지 않았다.특히 WTA 투어와는 정치적인 대립으로 인한 개최 보류 조치까지 더해졌다.그러나 7월 세계대학경기대회를 청두에서 개최한 것을 시작으로 이달 중 항저우 아시안게임과 테니스, 골프 등의 투어 대회 등을 통해 본격적으로 그동안 닫았던 빗장을 푸는 모양새다.가오즈단 중국 국가체육총국장은 13일 열린 항저우 아시안게임 중국 국가대표 선수단 결단식에서 ""국가에 영광을 가져오고, 중국의 현대적인 스포츠 훈련의 막강한 위력을 보여달라""며 ""선수들 모두 정치의식을 고취해 이번 대회를 통해 우리나라의 개혁, 경제 발전, 사회 진보에 대한 긍정적인 이미지를 아시아와 국제 사회에 제시하자""고 말했다.[연합뉴스]"
382;0001075385;스포츠토토코리아, 도박문제 인식 주간 맞아 온·오프라인으로 적극적 활동 펼쳐;국민체육진흥공단에서 발행하는 체육진흥투표권 스포츠토토의 수탁사업자 스포츠토토코리아가 ‘도박문제 인식 주간’을 맞아 베트맨을 통한 온라인 홍보를 강화하고, 전라남도 여수에 위치한 여수해양공원에서 건전화 캠페인을 전개하는 등 다양한 온·오프라인 활동을 전개하고 있다고 14일(목) 밝혔다.지난 11일(월)부터 오는 17일(일)...;https://imgnews.pstatic.net/image/thumb154/382/2023/09/14/1075385.jpg;2023-09-14T11:53:01;-스포츠토토코리아, ‘도박문제 인식 주간’ 맞아 온라인 홍보 강화 및 건전화 캠페인 활동 전개-도박중독 예방, 과몰입 방지 등 건전한 스포츠토토 이용 위해 앞으로도 전국 현장 찾아 캠페인 활동 꾸준히 펼칠 예정국민체육진흥공단에서 발행하는 체육진흥투표권 스포츠토토의 수탁사업자 스포츠토토코리아가 ‘도박문제 인식 주간’을 맞아 베트맨을 통한 온라인 홍보를 강화하고, 전라남도 여수에 위치한 여수해양공원에서 건전화 캠페인을 전개하는 등 다양한 온·오프라인 활동을 전개하고 있다고 14일(목) 밝혔다.지난 11일(월)부터 오는 17일(일)까지는 사행산업통합감독위원회와 한국도박문제예방치유원이 지정한 ‘도박문제 인식 주간’이다. 이는 사회적 문제로 대두되고 있는 도박문제의 심각성을 알리는 한편 도박중독 예방 및 치유를 위해 특별히 지정된 기간이다.이 기간 중 체육진흥투표권의 수탁사업자인 스포츠토토코리아는 국내 사행산업자로서의 책임감을 가지고 고객들과 일반시민들을 대상으로 온·오프라인에서 다양한 활동에 집중하고 있다.먼저 스포츠토토코리아는 공식 인터넷 발매 사이트 베트맨에 관련 팝업을 띄우고, 주 2회 발행되는 스포츠토토 경기정보지 ‘토토가이드’에도 포스터를 게재하는 등 적극적인 온라인 홍보를 전개했다.오프라인 캠페인 역시 강화했다. 스포츠토토코리아는 지난 8일(금)부터 9일(토)까지 여수해양공원 일대에서 광주전남도박문제예방치유센터, 여수시중독관리통합지원센터, 전남스마트쉼센터, 소상공인시장진흥공단, 광주호남지역본부, 백년가게 및 백년소공인 등과 함께 도박중독 예방 캠페인을 펼쳤다.이틀에 걸쳐 스포츠토토코리아 관계자는 현장을 방문한 여수시민들을 대상으로 소액으로 건전하게 투표권을 구매하겠다는 내용의 서약서를 받고, 스포츠토토 관련 공익 영상을 소개하는 등 적극적인 계도활동을 진행했다.스포츠토토코리아 관계자는 “나날이 급증하는 도박중독에 대한 사회적 심각성에 공감하며, 도박문제 인식 주간을 맞아 적극적인 활동을 펼치기 위해 최선을 다하고 있다”며 “올해 연말까지 전국 각 지역에서 펼치는 도박중독 예방 캠페인에도 많은 관심과 참여를 부탁한다”고 말했다. [스포츠동아]
425;0000143834;동아시아 보디빌딩&피트니스 선수권, 제주서 개최;2023 동아시아 보디빌딩&피트니스 선수권대회 포스터 [대한보디빌딩협회 제공] 2023년 동아시아 보디빌딩&피트니스 선수권대회가 15일부터17일일까지 사흘 간 제주특별자치도 제주학생문화원 대강당에서 열린다.올해 처음으로 개최되는 이번 대회에선 보디빌딩과 함께 세계피트니스&보디빌딩연맹(IFBB)에서 새로 선보이는 웰니스,...;https://imgnews.pstatic.net/image/thumb154/425/2023/09/14/143834.jpg;2023-09-14T11:53:01;2023 동아시아 보디빌딩&피트니스 선수권대회 포스터 [대한보디빌딩협회 제공] 2023년 동아시아 보디빌딩&피트니스 선수권대회가 15일부터17일일까지 사흘 간 제주특별자치도 제주학생문화원 대강당에서 열린다.올해 처음으로 개최되는 이번 대회에선 보디빌딩과 함께 세계피트니스&보디빌딩연맹(IFBB)에서 새로 선보이는 웰니스, 핏모델 등 국내에서는 다소 생소한 종목들도 함께 치러진다.한국을 비롯해 일본, 몽골 등의 선수들이 참가하하며 종목별 우승자에게는 '프로 카드'를 준다.지난해 7월 열린 IFBB 심판강습회를 통해 배출된 국내 'IFBB 국제심판'들이 심사에 나선다.
