oid;aid;title;subContent;thumbnail;dateTime;content117;0003770329;태권도진흥재단, '주월한국군 태권도 교관단' 활동 보고서 발간;"주월한국군 태권도교관단의 활동과 기증자료 분석보고서.&#8200;/태권도진흥재단&#8200;제공기증 유물(월남의 태권도, 주월한국군태권도협회). /태권도진흥재단&#8200;제공[마이데일리 = 심재희 기자] 태권도진흥재단(이사장 직무대행 이종갑) 국립태권도박물관이 '주월한국군 태권도 교관단의 활동과 기증자료 분석 보고서'를...";https://imgnews.pstatic.net/image/thumb154/117/2023/09/14/3770329.jpg;2023-09-14T09:59:01;"주월한국군 태권도교관단의 활동과 기증자료 분석보고서. /태권도진흥재단 제공기증 유물(월남의 태권도, 주월한국군태권도협회). /태권도진흥재단 제공[마이데일리 = 심재희 기자] 태권도진흥재단(이사장 직무대행 이종갑) 국립태권도박물관이 '주월한국군 태권도 교관단의 활동과 기증자료 분석 보고서'를 발간했다. 1960년대부터 1970년대 월남전 당시 한국군 태권도 교관단의 파병과 활동을 정리하고 관련 자료를 문화재로 등록하려는 계획을 세웠다.보고서는 월남전 당시 파병된 600여 명 태권도 교관단의 1964년부터 1973년까지 10여 년간의 활동을 담고 있다. 태권도 교관단은 현지에서 23만여 명에게 태권도를 지도했고, 2916명의 유단자 배출했다. 351회의 태권도 시범으로 태권도를 알리는 첨병 구실을 톡톡히 했다. 한국과 한국군에 대한 호감도를 높이고 한국군 작전에도 다양한 긍정적 효과를 미쳤다.태권도진흥재단은 태권도 해외 진출사에서 주월 한국군 태권도 교관단이 출발선에 있기 때문에 이번 보고서에 더 큰 의미를 둔다. 국가 차원에서 태권도 교관이 장기간 파견되어 주둔국의 군인과 국민을 대상으로 태권도 교육과 시범을 보인 것은 주월 태권도 교관단이 처음이자 유일하다. 또한 대한민국 정부 수립 이후 한국군의 첫 해외 파병이면서 가장 먼저 파병된 부대가 태권도 교관단이었다는 점도 또 다른 눈길을 끈다. 특히, 군사원조의 일환으로 태권도 교육 보급이 군인과 민간인까지 확대돼 태권도 가치 보존에 큰 역사적 의미를 지닌다.이번 보고서는 월남전 태권도 교관단에 대한 자료 부족 등을 극복하고 발간됐다. 지난 3월 주월 한국군 교관단에서 국립태권도박물관에 문서, 기념패, 메달, 훈장, 사진 등 227점의 자료를 기증했다. 주월 한국군 태권도 교관단 활동에 대한 실증적 유물로 보고서 발간을 결정했다.태권도진흥재단은 이번 분석 보고서 발간을 시작으로 내년 상반기 국립태권도박물관에서 '주월한국군 태권도 교관단 기증전(가칭)' 개최를 추진한다. 아울러 '주월한국군 태권도교관단의 활동과 기증자료 분석보고서'를 국립태권도박물관 누리집과 태권도라키비움 사이트에 공개하고, 태권도 단체와 군 관련 기관 등에 전달하는 등 관련 연구를 이어갈 계획이다. 기증 유물(태권도 용어, 태권도 교관 김양곤 대위). /태권도진흥재단 제공태권도진흥재단 이종갑 이사장 직무대행은 ""태권도 해외 진출에 있어 첫 발자취라고 할 수 있는 주월 태권도 교관단의 사진과 동영상 자료는 매우 희귀성을 지니고 있다""며 ""태권도 가치를 보존하고 이어가는 것이 우리 재단의 역할로 앞으로도 최선의 노력을 다 하겠다""고 힘줬다."
001;0014192098;전북 장애인체전 15일 김제서 개막…2천명 참가;전북도민체전 개회식 장면 [전북도 장애인체육회 제공](전주=연합뉴스) 최영수 기자 = 제17회 전라북도 장애인체육대회가 오는 15일부터 사흘간 김제시 일원에서 펼쳐진다. '금빛 희망 전라북도! 함께하는 김제에서!'를 슬로건으로 14개 시군 선수와 임원 등 2천여명이 선의의 경쟁을 펼친다. 개최 종목은 육상, 배드민턴, 보...;https://imgnews.pstatic.net/image/thumb154/001/2023/09/14/14192098.jpg;2023-09-14T09:49:55;"전북도민체전 개회식 장면 [전북도 장애인체육회 제공](전주=연합뉴스) 최영수 기자 = 제17회 전라북도 장애인체육대회가 오는 15일부터 사흘간 김제시 일원에서 펼쳐진다.    '금빛 희망 전라북도! 함께하는 김제에서!'를 슬로건으로 14개 시군 선수와 임원 등 2천여명이 선의의 경쟁을 펼친다.    개최 종목은 육상, 배드민턴, 보치아, 파크골프 등 19개며 태권도가 시범종목으로 운영된다.    한궁, 슐런, 플로어 컬링은 전시 종목으로 개최돼 도민에게 장애인 스포츠를 체험할 기회를 제공한다.    개회식은 15일 오후 3시, 폐회식은 17일 오후 3시 김제시 실내체육관에서 열린다.    도 장애인체육회 관계자는 ""개·폐회식, 행사, 경기 운영, 장애인 편의시설 등 대회 상황을 꼼꼼히 챙기겠다""고 말했다.    kan@yna.co.kr"
421;0007049334;HL 안양, '젊은 피' 앞세워 아시아리그 아이스하키 'V8' 도전;HL 안양 수비수 남희두 (HL 안양 제공)(서울=뉴스1) 이재상 기자 = 아시아리그 아이스하키 디펜딩 챔프 HL 안양이 통산 8번째 정상 등극을 향한 시동을 건다. 백지선 감독이 지휘하는 HL 안양은 16일 오후 3시10분 일본 도마코마이 네피아 아이스링크에서 열리는 2023-24 아시아리그 아이스하키 정규리그 원정 개...;https://imgnews.pstatic.net/image/thumb154/421/2023/09/14/7049334.jpg;2023-09-14T09:48:58;"16일 레드이글스 상대로 2023-24시즌 정규리그 개막 원정 경기HL 안양 수비수 남희두 (HL 안양 제공)(서울=뉴스1) 이재상 기자 = 아시아리그 아이스하키 디펜딩 챔프 HL 안양이 통산 8번째 정상 등극을 향한 시동을 건다. 백지선 감독이 지휘하는 HL 안양은 16일 오후 3시10분 일본 도마코마이 네피아 아이스링크에서 열리는 2023-24 아시아리그 아이스하키 정규리그 원정 개막전에서 레드이글스 홋카이도와 맞붙는다. 원정 경기로 시즌을 시작하는 부담을 극복하고 전통 라이벌이자 최대 난적으로 꼽히는 레드이글스의 기를 시작부터 확실히 꺾어 놓는다는 것이 HL 안양의 각오다. HL 안양은 지난 시즌 우승을 차지하며 쌓은 자신감과 새로운 전력 중추로 자리매김하고 있는 젊은 선수들의 에너지를 바탕으로 정상을 지켜낸다는 목표다. HL 안양은 지난 시즌 코로나19 팬데믹으로 인한 2년 7개월 여의 공백을 딛고 정규리그와 플레이오프에서 잇달아 정상에 올랐다. 아시아리그 통산 최다인 7번째 우승 트로피를 안으며 HL 안양 아이스하키의 미래를 이끌어 갈 젊은 선수들의 잠재력을 확인하는 소득까지 얻었다. 남희두(26), 오인교(25), 유범석(25), 지효석(24·이상 디펜스), 송종훈(26), 이주형(25), 이종민(24), 김건우(24·이상 포워드) 등 '젊은 피'는 경기를 치를수록 발전을 거듭하며 HL 안양 정상 등극의 선봉장 역할을 해냈다. 이들은 기술적인 발전에 더해 지난 시즌 정상에 오르며 자신감이 붙고 경험까지 축적돼 올 시즌 한층 성장한 모습을 보여줄 것으로 기대된다. 베테랑 골잡이 김기성(38)이 은퇴한 공격진에는 캐나다, 스웨덴 등 해외무대에서 성장한 신예 이총민(24)이 새롭게 가세했고 미국 프로리그 ECHL(NHL 하위리그)에 진출했던 신상훈이 복귀했다. 스피드와 스킬이 뛰어난 이총민은 중학교 시절 캐나다로 유학, 주니어 A 명문리그인 BCHL에서 활약하던 2018-19시즌 우승을 차지한 특급 유망주다. 그는 2021년부터 지난해까지 스웨덴 하부리그에서 뛰었고 HL 안양 유니폼을 입고 아시아리그 아이스하키에 데뷔하게 됐다.지난 시즌 ECHL 애틀랜타 글래디에이터의 주포(70경기 30골 22어시스트)로 자리매김했던 신상훈은 북미 리그 경험이 쌓이며 특유의 스피드와 폭발력이 강화됐다는 평이다.HL 안양으로 돌아온 신상훈 (HL 안양 제공)수비라인에는 최진우(26)가 병역을 마치고 복귀했고 지난 시즌 도중 무릎 부상을 당했던 김원준(32)이 성공적으로 재활을 마무리하고 돌아왔다. 파워풀한 플레이를 펼치는 최진우와 빼어난 공수 밸런스를 갖춘 김원준의 가세로 HL 안양 수비라인은 지난 시즌에 비해 한결 탄탄해질 것으로 기대된다. 골문은 '한라성' 맷 달튼(37)이 변함없이 지키는 가운데 이연승(28)과 김기완(23)이 뒤를 받친다. 백지선 감독은 ""에너지와 창의적인 플레이가 넘쳐나는 여러 부분에서 팬들이 만끽할 수 있는 즐거운 하키를 보여주겠다""며 ""저돌적으로 퍽을 사냥하는 맹수와 같은 모습으로 우승 트로피를 쟁취해 팬들에게 선사하겠다""면서 공격적이고 다이내믹한 아이스하키를 다짐했다. 한편 2023-24 아시아리그 아이스하키는 히가시홋카이도 크레인스(일본)가 구단 사정으로 불참하며 지난 시즌보다 1개 팀이 줄어든 5개 팀으로 운영된다. 팀 당 32경기의 정규리그를 치른 후 상위 2개 팀이 5전 3선승제의 파이널을 통해 챔피언을 가린다. 16일과 17일 도마코마이 원정으로 시즌을 시작하는 HL 안양은 23일과 24일 안양아이스링크에서 닛코 아이스벅스를 상대로 홈 개막 2연전을 치른다."
144;0000912928;강원동계청소년올림픽 성공을 위한 메시지[송석록의 생각 한편];송석록 교수강원도는 동계올림픽의 메카로 자리 잡을 만큼 성공적인 올림픽 도시가 되어가고 있다. 그럼에도 2024 강원동계청소년올림픽을 앞두고 대회 개최에 대한 걱정이 앞선다. 지난 잼버리 파행 사태로 인한 대규모 이벤트에 국민적 불신이 높아 국제적 스포츠이벤트에 대한 사전점검은 수백 번을 강조해도 부족하다. 국민적 무관심...;https://imgnews.pstatic.net/image/thumb154/144/2023/09/14/912928.jpg;2023-09-14T09:42:03;송석록 교수강원도는 동계올림픽의 메카로 자리 잡을 만큼 성공적인 올림픽 도시가 되어가고 있다. 그럼에도 2024 강원동계청소년올림픽을 앞두고 대회 개최에 대한 걱정이 앞선다. 지난 잼버리 파행 사태로 인한 대규모 이벤트에 국민적 불신이 높아 국제적 스포츠이벤트에 대한 사전점검은 수백 번을 강조해도 부족하다. 국민적 무관심과 홍보부족, 각종 프로그램 부족 등 해결해야 할 일이 산적하다. 강원동계청소년올림픽은 2024년 1월 19일 개막식을 시작으로 2월 1일까지 개최된다. 이번 동계청소년올림픽에 80여 개국에서 선수 1900명이 참가한다. 또한 방문객도 외국인 포함 25만 명에 이를 것으로 예상된다. 이번 대회는 강원도 일원에서 개최되며 빙상종목은 강릉에서 개최되고 평창, 횡성, 정선에서 분산 개최된다.■ 청소년올림픽의 시작청소년 올림픽은 전세계 젊은이들을 위한 엘리스 스포츠 대회이다. 자크 로게 전 IOC 위원장의 제안으로 2007년 IOC총회에서 승인되었다. 청소년올림픽은 전세계 15세에서 18세의 선수들이 참가하고 하계와 동계로 구분하여 각각 4년 주기로 개최된다. 동계청소년올림픽은 2012년 인스부르크에서 최초로 열렸다. 지금까지 오스트리아 인스부르크를 비롯하여 노르웨이 릴레함메르 및 스위스 로잔에서 개최되었다. 청소년올림픽의 특징 중 하나는 남녀 선수 성비를 50대 50으로 균형을 갖추는 것이다. 2018 부에노스 아이레스 청소년올림픽에서 4000명의 선수가 참여하여 최초로 양성평등을 이루기도 하였다.■ 스위스 로잔은 올림픽 수도스위스 로잔은 2020 동계청소년올림픽을 개최하였다. 로잔은 IOC본부를 비롯해 55개의 국제스포츠연맹의 본부가 있는 아름다운 국제스포츠의 도시이자 ‘올림픽 수도’이다. 1994년 국제올림픽위원회로부터 ‘올림픽 수도’로 승인받았다. 성공적인 동계청소년올림픽을 개최한 것으로 평가 받는 로잔은 1948년 세인트 모리츠 동계올림픽 이후 72년 만에 올림픽 운동의 중심지로 거듭났다. IOC에 의하면, 81개 세부종목에 79개국에서 1872명의 선수가 참가하였다.■ 스위스 로잔을 배우다로잔 동계청소년올림픽에서 특징은 대중교통을 이용하는 것이다. 선수를 포함하여 모든 참가자들은 대중교통을 이용하게 집중적인 홍보를 하였다. 이를 통해 모든 국가들이 집중적으로 대응하고 있는 기후문제인 온실가스 배출량 즉, 탄소 발자국(Carbon footprint)이 감소하였다. 또한 청소년들에게 대회 개최 1년 전부터 올림픽 교육자료를 배포하고 올림픽 교육을 했다. ‘배움과 공유’ 프로그램에 8만명의 어린이들이 참여했으며 13만 명의 학생들이 각종 경기를 즐겼다.강원동계청소년올림픽은 청소년을 위한 축제이자 문화와 교육이 어우러진 미래 세대의 꿈과 희망을 엿볼 수 있는 자리이다. 문화체육관광부 뿐만이 아니라 강원도청, 도교육청의 적극적인 대응도 요구된다. 디지털 세상에 태어난 청소년들에게 동계스포츠에 최적화된 첨단기술인 스포츠XR메타스페이스 등을 체험하게 하는 것도 과학기술 강국의 위상을 보여주는 방법일 것이다.<송석록 경동대 교수(독일 루르대학교 스포츠학 박사)>
028;0002656527;아이스하키 아시아리그 개막, HL안양 ‘젊은 피’ 앞세워 V8 도전;HL안양의 신상훈. HL안양 제공아시아리그 아이스하키 디펜딩 챔피언 HL 안양이 통산 8번째 정상을 노린다.백지선 감독이 이끄는 HL 안양은 16일 오후 3시 10분 일본 도마코마이 네피아 아이스링크에서 열리는 2023~2024 아시아리그 아이스하키 정규리그 원정 개막전에서 레드이글스 홋카이도와 맞붙는다.HL 안양은 14...;https://imgnews.pstatic.net/image/thumb154/028/2023/09/14/2656527.jpg;2023-09-14T09:33:07;16일 레드 이글스와 원정 개막전HL안양의 신상훈. HL안양 제공아시아리그 아이스하키 디펜딩 챔피언 HL 안양이 통산 8번째 정상을 노린다.백지선 감독이 이끄는 HL 안양은 16일 오후 3시 10분 일본 도마코마이 네피아 아이스링크에서 열리는 2023~2024 아시아리그 아이스하키 정규리그 원정 개막전에서 레드이글스 홋카이도와 맞붙는다.HL 안양은 14일 보도자료를 내, “지난 시즌 우승을 차지하며 쌓은 자신감과 새로운 전력 중추로 자리매김하고 있는 젊은 선수들의 에너지를 바탕으로 정상을 지켜내겠다”고 밝혔다.HL 안양은 지난 시즌 코비드19로 인한 2년 7개월여의 공백을 딛고 정규리그와 플레이오프에서 잇달아 정상에 올랐다. 아시아리그 통산 최다인 7번째 우승 트로피를 안았다.이 과정에서 젊은 선수들은 더 성장했다. HL 안양은 “남희두(26), 오인교(25), 유범석(25), 지효석(24·이상 수비), 송종훈(26), 이주형(25), 이종민(24), 김건우(24·이상 공격) 등 ‘젊은 피’는 경기를 치를수록 발전을 거듭했다”고 설명했다.골잡이 김기성(38)이 은퇴한 공격진에는 캐나다, 스웨덴 등에서 뛴 이총민(24)이 가세했고, 미국 프로리그 ECHL에 진출했던 신상훈이 복귀했다.이총민은 HL 안양 유니폼을 입고 아시아리그 아이스하키에 데뷔하게 됐고, 지난 시즌 ECHL 애틀랜타 글래디에이터의 주포(70경기 30골 22도움)로 활약한 신상훈은 스피드와 폭발력이 더 붙었다는 평을 받는다.수비라인에는 최진우(26)가 병역을 마치고 복귀했고 지난 시즌 도중 무릎 부상을 당했던 김원준(32)이 재활을 마무리하고 돌아왔다.골문은 변함없이 맷 달튼(37)이 맡는다.백지선 감독은 “에너지와 창의적인 플레이가 넘쳐나는, 여러 면에서 팬들이 만끽할 수 있는 즐거운 하키를 보여주겠다. 저돌적으로 빠르게 퍽을 사냥하는 맹수와 같은 모습으로 우승 트로피를 쟁취하겠다”고 강조했다.2023~2024 아시아리그 아이스하키는 지난 시즌보다 1개 팀이 줄어든 5개 팀으로 운영된다.HL 안양은 23~24일 안양아이스링크에서 닛코 아이스벅스를 상대로 홈 개막전을 벌인다.
421;0007049292;OK금융 배구단·럭비단, 오사카 재외한국학교 학생들 위한 재능기부 나서;금강학교에서 일일 교사로 나선 OK금융그룹 배구선수들(OK금융그룹 스포츠단 제공)(서울=뉴스1) 이재상 기자 = 해외 전지훈련에 나선 OK금융그룹 배구단과 럭비단이 재외한국학교인 '오사카 금강 인터내셔널 스쿨(이하 금강학교)' 학생들을 위해 일일 선생님으로 나섰다.OK금융그룹 스포츠단은 현재 일본에서 전지훈련 중인 배구단...;https://imgnews.pstatic.net/image/thumb154/421/2023/09/14/7049292.jpg;2023-09-14T09:32:56;"배구단은 4일, 럭비단은 3일부터 일본서 해외 전훈 중금강학교에서 일일 교사로 나선 OK금융그룹 배구선수들(OK금융그룹 스포츠단 제공)(서울=뉴스1) 이재상 기자 = 해외 전지훈련에 나선 OK금융그룹 배구단과 럭비단이 재외한국학교인 '오사카 금강 인터내셔널 스쿨(이하 금강학교)' 학생들을 위해 일일 선생님으로 나섰다.OK금융그룹 스포츠단은 현재 일본에서 전지훈련 중인 배구단과 럭비단 선수들이 12~13일 이틀 간 금강학교 학생들을 대상으로 재능기부를 했다고 14일 밝혔다.이달 초 일본으로 떠난 OK 배구단과 럭비단 선수들은 훈련지인 오사카에서 스포츠 재능 나눔 활동을 진행할 방안을 고민했고 구단주인 최윤 OK금융그룹 회장이 이사장으로 있는 재외한국학교인 금강학교를 방문해 재능기부 수업을 진행하기로 했다.배구·럭비교실은 금강학교 중·고교생 약 150명이 참석한 가운데 진행됐다.금강학교에서 일일 교사로 나선 OK금융그룹 배구선수들(OK금융그룹 스포츠단 제공)배구 선수들은 학생들의 눈높이에 맞춰 공격, 수비 등 기본기 교육과 함께 네트를 두고 선수들이 올려주는 볼을 직접 스파이크 하는 시간을 가졌다. 읏맨 럭비단 선수들이 선생님으로 나선 럭비교실 역시 기본 기술을 전수하고 몸싸움 없이 공을 갖고 뛰고 트라이를 하는 '태그 럭비' 게임도 진행했다.이날 행사에 함께한 배구단 오기노 마사지(일본) 감독은 ""뜻깊은 행사에 함께해 기쁘다. 학생들에게는 좋은 추억이, 선수들에게는 새로운 동기부여가 됐으면 한다""고 말했다.럭비단의 오영길 감독 역시 ""선수들과 함께한 추억이 한국 럭비에 관심을 가지는 계기가 되어 세계 무대에서 활약하는 한국 럭비를 향한 응원으로 이어지길 바란다""고 전했다.한편 8년 만에 해외 전지훈련에 나선 OK금융그룹 배구단은 4일부터 11일까지 나고야에서 전지훈련 첫 주차를 보냈고 11일 오사카로 이동해 잔여 일정을 소화 중이다.읏맨 럭비단은 13일 세쓰난 대학 럭비부와 연습경기를 치르고 일본 럭비 리그1 디비전2 소속 NTT 도코모와 두 차례 합동훈련을 진행한 뒤 16일 귀국한다.OK금융그룹 럭비단 (OK금융그룹 스포츠단 제공)"
382;0001075340;대전시교육청 토요스포츠 리그 코로나로 위축된 학교체육 활기;지난 8월5일 열린 토요스포츠 리그 농구경기에서 대성고와 유성고가 열전을 펼치고 있다. 사진제공 | 유성고《학교체육진흥회와 스포츠동아는 학교체육 활성화를 위해 ‘2023 학생 스포츠기자단’을 운영합니다. 올해로 3년 차에 접어든 ‘학생 스포츠기자단’은 중·고등학생을 대상으로 공모를 통해 선발된 학생기자들이 다양한 학교 스...;https://imgnews.pstatic.net/image/thumb154/382/2023/09/14/1075340.jpg;2023-09-14T09:32:01;7종목 145개교 2735명 출전…12월까지 개최지난 8월5일 열린 토요스포츠 리그 농구경기에서 대성고와 유성고가 열전을 펼치고 있다. 사진제공 | 유성고《학교체육진흥회와 스포츠동아는 학교체육 활성화를 위해 ‘2023 학생 스포츠기자단’을 운영합니다. 올해로 3년 차에 접어든 ‘학생 스포츠기자단’은 중·고등학생을 대상으로 공모를 통해 선발된 학생기자들이 다양한 학교 스포츠 활동 및 일반 스포츠 관련 소식을 취재해 소개합니다. 이를 통해 학생들의 스포츠 활동에 대한 관심을 높이고, 건강하고 활기찬 학교체육 문화조성에 앞장 설 것입니다. ‘학생 스포츠 기자단’이 취재한 기사는 선별해 매월 1회 지면을 통해 게재됩니다.》2023학년도 토요스포츠 리그가 4월부터 12월까지 9개월간 진행한다. 대전시교육청에서 주관하는 토요스포츠 리그의 운영 종목은 축구, 농구, 배구, 피구, 넷볼, 배드민턴, 풋살 등 7종목이다. 참가학교와 학생은 초등학교 35개교 710 명, 중학교 72개교 1320명, 고등학교 38개교 705명 등 총 145개교, 2735명이다.  코로나19 펜데믹으로 인한 사회적 거리 규정으로 인해 2020년부터 약 3년간 학생들의 체육활동은 제약이 많았다. 2021년에는 비대면으로 스포츠클럽을 운영하기도 했다. 학교생활에 활력이 떨어지고 지친 학생들에게 토요스포츠 리그는 활기찬 일상 회복에 도움을 주어 인기가 높다. 지난 8월 열린 대성고와 유성고의 농구 경기의 열기가 대단했다. 유성고의 패배로 끝났지만 두 팀 모두 경기의 승패보다 타 학교 학생들과 경기를 할 수 있다는 즐거움이 큰 듯 보였다. 경기에 참가한 학생은 “코로나 때문에 체육대회도 제대로 못해서 아쉬웠는데, 경기가 너무 즐거웠다”고 전했다. 토요스포츠 리그의 활성화는 위축됐던 학교 체육에 활기를 불어 넣고, 학생들의 건강한 학교생활에도 많은 도움을 줄 것으로 보인다.정찬영 학생기자(유성고 2)
